AuthorID,Author,Date,Content,Attachments,Reactions
"891563487241842699","jbonhage155","2023-08-01T13:19:46.2190000+08:00","I'm curious as well about it .. did they rename it SiteWise Edge?
Specifically around the ability to normalized/contexualize the data (is there a scripting component?)

I do like AWS manages / controls the SiteWise edge nodes","",""
"568913935147728896","zeratall","2023-08-03T09:16:04.2500000+08:00","I’ve used it in some initial prototyping both in the cloud and in Greengrass. I enjoyed using it to do some basic modeling, but imho the mapping is really clunky. I much prefer the UX that IH provides around modeling and mapping tags to data model/instance properties then sitewise.","",""
"766684226455207996","bright_hummingbird_31342","2023-08-03T11:05:45.0550000+08:00","Thanks for the input.  Overall, I've been underwhelmed by it, but I've been curious if anyone has had different experiences.  I'm curious what applications where it works well.

The console is definitely clunky.  It seems like everyone who successfully adopting is doing some sort of trickery with an alternative interface or a script.  It does seem rigid as a time series solution and the API does not seem to align well with user intent.  The approach to hierarchy is a bit odd with all the model/asset creation.","",""
"766684226455207996","bright_hummingbird_31342","2023-08-03T11:08:46.1260000+08:00","SiteWise Edge is just on the on-prem or edge component.  It can be used as a local ingest and time series database.  SiteWise is the cloud version.","",""
"958349073126129665","niravpatel16","2023-08-09T22:48:11.8240000+08:00","We use SiteWise in our Digital transformation stack. However, there are limitations that you must be aware of. 1. SiteWise has specific quotas and limitations that you must read to see if this will work for your use case. 2. SiteWise suits time series (OPC, MQTT, Modbus) and well-structured historians. But as a suggestion, don't try to ingest non-telemetry data via SiteWise, it doesn't perform well with some structured data for example, (Batch, Recipe, etc..) 3. SiteWise minimum requirement is 16 GB on Linux-hosted Edge. But this is not true, 32 GB is ideal, as we have seen spikes in memory up to 21 GB without any computing at the Edge. 4. The one feature of SiteWise I like is its modeling and asset hierarchy other than that the product still needs to be mature more. 5. All private components must be written in a choice of coding language. 5. Logging and troubleshooting can be very challenging on custom components. 6. There is no easy way to enable/disable the components when not needed.  For now, these are my observations.","",""
"766684226455207996","bright_hummingbird_31342","2023-08-09T22:49:54.8940000+08:00","Despite these limitations, why do you still use it in your stack?  Have you looked into alternative time series solutions?","",""
"958349073126129665","niravpatel16","2023-08-09T22:53:32.0440000+08:00","Good point. Even I don't know the answer. The decision is above and beyond my reach. But I have separated non-time-series data to dump directly to S3 via StreamManager/Greengrass v2. This has resolved our issues with structured data for the time being. But will SiteWise Edge scale well... I don't know.","",""
"958349073126129665","niravpatel16","2023-08-09T23:27:30.9080000+08:00","SiteWise Edge allows you to retrieve your model and assets at the Edge for any custom application or use case via API. When you lose connectivity with cloud SiteWise to S3 for data-lake, you can continue on your local dashboard or apps without getting affected if you like. SiteWise StreamMangaer is a transient hot-tier that can store data for up to 30 days (Dependent on hardware and tags) FIFO. If you like you can enable the data processing pack, which allows you to contextualize and compute data at the Edge at $400/month.","",""
"867075936054149191","rickbullotta","2023-08-10T00:22:24.0530000+08:00","I'm fairly sure that SiteWise Edge uses InfluxDB internally.","",""
"795178288330440704","youri.regnaud","2023-08-14T02:12:18.4230000+08:00","It's not always easy to understand the technologies behind AWS offerings","",""
"538476855892770836","leafert.","2023-08-17T05:19:08.2760000+08:00","Hi, has anyone of you have experience with Smartsheet? If so, how can I make use of the Smartsheet API and publish data back into Smartsheet. Currently I managed to get data from Smartsheet into an Azure SQL database. Now, I want to send data into Smartsheet from the SQL database. Any suggestions?","",""
"833941249362493450","sammysevens777","2023-08-17T13:56:30.4900000+08:00","So it looks like smartsheet is ""restful"" - write an azure function in python to get data from your db - and then post to smartsheet. 

So ""select....."" From your db, and then ""post"" to smartsheet","",""
"833941249362493450","sammysevens777","2023-08-17T13:56:44.3040000+08:00","Disclaimer - i have no experience with smartsheet 😆","",""
"698244484302897323","lmtx","2023-10-09T20:23:01.1850000+08:00","Managing AWS IoT infrastructure like a pro. Developers-focused training!

The Internet of Things infrastructure spans across local devices and cloud services, but that is not the only differentiator.

Some IoT assets are ""static"", do not change often, and are sparse.
We can design and deploy ""static"" infrastructure upfront using technologies like CDK (Cloud Development Kit).
""Dynamic"" assets represent items created on demand. Sometimes, we can not predict the total number of ""dynamic"" assets. To manage those objects, we use applications leveraging SDK (Software Development Kit).

I started working on developers-focused training to help you manage AWS IoT infrastructure. No AWS knowledge is required, but familiarity with Python is highly recommended.

Please let me know if you are interested in this training and what topics I should include in the scope.","https://cdn.discordapp.com/attachments/740336311671586968/1160915320299585636/aws_iot_greengrass.001.png?ex=68df1765&is=68ddc5e5&hm=6b9d2c8e3104218b86a9769b87ad255740d0228104ce3f9cdbd3f5d079ac546b&",""
"698244484302897323","lmtx","2023-10-18T19:35:04.7450000+08:00","I wrote a book about the Internet of Things using AWS Cloud:

https://a.co/d/4qDOA3r

This book provides an introduction to the Internet of Things domain, covering various aspects of connectivity and device management using AWS Cloud.

Key Features

* Technical foundations of the Internet of Things explained and reinforced with sample implementations.
* Uncovered the reasoning behind best practices tested in real-life commercial deployments.
* Hands-on exercises using an interactive IoT Lab environment.

I hope you will find it interesting. Let me know in case of any questions!","","📕 (1)"
"698244484302897323","lmtx","2023-10-25T18:05:48.8100000+08:00","Why Infrastructure as Code is crucial to effectively managing your assets?

Modern solutions utilize distributed infrastructure to deliver business value. Manual management of those assets is error-prone, time-consuming, and does not scale. Fortunately, we often leverage a virtual infrastructure offered by the cloud providers. One of the benefits of a cloud is that we can describe it using code. That approach is called Infrastructure as Code (IaC).

What benefits does IaC offer?

IaC enables using agile software development methodology to describe and manage infrastructure. As a result, we achieve the:

* Ease of reviewing the environment's configuration because it is defined using the source code. You don't need to log into the AWS Web Console and manually browse cloud resources.
* Quickly reproduce the working setup by invoking our code again. Moreover, we can experiment with various configurations by modifying the parameters of our invocations.
* Version the source code to track changes introduced to the environment. This is crucial for debugging and auditory purposes.","https://cdn.discordapp.com/attachments/740336311671586968/1166678997330034688/iac_post.png?ex=68def73c&is=68dda5bc&hm=21539571f4adea5beb63efea7c85a6bf0999530b908cc4ea3f0b4d277e35016c&",""
"698244484302897323","lmtx","2023-10-30T16:10:26.2910000+08:00","Working with cloud/virtual assets is way easier than with actual hardware and OT systems. That is my personal opinion, but I've got some reasons to back it up.

We can manage cloud/virtual resources like software. That abstract approach enables fast development cycles utilizing:

* Infrastructure as Code (IaC) capabilities
* automated deployment and testing
* unlimited number of development/test environments

Copy of the production environment needs minutes to deploy. We can experiment/break/destroy/recreate it as frequently as necessary, doing no harm to the business continuity. That is a pretty fantastic capability!

Some companies try to implement this approach in the hardware space, but handling physical assets is slower than with virtual objects by its very own nature.

That is why I do claim that working with cloud/virtual assets is easy.

The real question is how to make developing hardware and OT infrastructure as agile as software.

Any ideas?","",""
"898217314741280828","hobbes1069","2023-10-31T02:00:14.9710000+08:00","I think some of this is being addressed but I don't know if the tech is ""there"" yet. So in my case I know how to install linux on bare metal and make it do things. That's great, but it doesn't make me very scalable. I would soon become my own bottleneck. And that ignores the maintenance / daily operations side of things. 

What I need is a management console were I can ""see"" all my edge devices in one place. Know if there is an issue or not, what the issue is, deploy updates, etc. I don't want to care if the edge device is x86, ARM, or even Apple Mx.

Basically, I want for edge devices what everyone else already uses/expects from major networking equipment providers. I run Ubiquiti at home, and if I plug in a new access point, the Network Controller will find it and I can adopt it with one click.

I think Portainer k2d's may do some of this...","",""
"698244484302897323","lmtx","2023-10-31T02:08:39.5610000+08:00","Fleet management is challenging; operating a heterogamous fleet is even harder.","",""
"898217314741280828","hobbes1069","2023-10-31T06:40:02.1550000+08:00","Hard, but shouldn't be impossible these days,","",""
"698244484302897323","lmtx","2023-10-31T15:47:09.0680000+08:00","Agreed.","",""
"794542235676180500","akoscs","2023-10-31T19:19:55.1390000+08:00","What do you mean by ""see"" all your edge devices? Centralized logs/traces/health checks are fairly easy to implement and cetralize to a prometheus/grafana dashboard. I you mean to also control them....well that is very framework dependent.","",""
"898217314741280828","hobbes1069","2023-10-31T20:02:01.4010000+08:00","Yes, full deployment, management, everything. I envision a slim bare metal linux install with docker.","",""
"794542235676180500","akoscs","2023-10-31T20:14:13.9680000+08:00","My simplest idea to do this was to have a company wide kubernetes cluster, add everything as a node and taint the nodes with special HW (I/Os) directly connected to it. That way you get pods running where they should and alll of it is one large system. Sadly could not try it  out in practice at a large scale.","",""
"898217314741280828","hobbes1069","2023-10-31T20:25:38.8720000+08:00","UMH kind of does this and I want to try it out as well but no time this year...","",""
"766684226455207996","bright_hummingbird_31342","2023-11-10T14:30:04.8650000+08:00","SiteWise Edge is built on InfluxDB.  SiteWise is built on DynamoDB.","","👍🏼 (1)"
"698244484302897323","lmtx","2023-11-23T17:59:58.7820000+08:00","The nature of input data defines the backend storage of an IoT system.

When designing the Internet of Things solution, I recommend starting by defining the nature of input data and the way we want to consume (analyze) it. Once we understand those aspects, we can decide on the appropriate way to transfer and store obtained information.

I described the primary use cases in my today's article.

Let me know if you have any questions!

https://www.thingrex.com/type_of_data_defines_storage/","",""
"891563487241842699","jbonhage155","2023-11-28T04:15:58.2030000+08:00","anyone used VMWare Tanzu for on-prem containerization?","",""
"1073620930636550276","alejandrosimo","2023-12-18T22:55:59.3340000+08:00","Hi everyone! I'm looking into the integration of HiveMQ with Azure. A common route seems to be using the HiveMQ Kafka Extension and Azure Event Hubs. Anyone here has tried different integration methods or knows of alternatives?","",""
"766684226455207996","bright_hummingbird_31342","2023-12-19T01:06:30.2680000+08:00","There are a lot of options in addition to HiveMQ's extensions.  

It's more important to ask...
What kind of data do you want Azure to ingest?
How will the data be consumed?  What is the use case?  What service(s) in Azure will use it?","",""
"867075936054149191","rickbullotta","2023-12-19T01:10:21.0100000+08:00","Azure is a lot of things - can you be more specific?","",""
"1073620930636550276","alejandrosimo","2023-12-19T18:13:19.7710000+08:00","I'm ingesting manufacturing time series data. My main goal for now is data analysis and reporting, but I also want to explore options for learning purposes","",""
"1073620930636550276","alejandrosimo","2023-12-19T18:24:00.1190000+08:00","So I'm just looking for other options to get the data in Azure for doing data analysis and for learning purposes. I think one option could be to use NodeRED to publish messages to an Event Grid mqtt broker or to IoT Hub. HiveMQ would be on prem btw. Another would be to create an Azure function that subscribes to the necessary topics from HiveMQ and then publish again to Event Grid.","",""
"867075936054149191","rickbullotta","2023-12-19T20:34:44.3860000+08:00","What would keep that Azire function “active”?","",""
"1073620930636550276","alejandrosimo","2023-12-19T20:44:05.2320000+08:00","The Azure function would be triggered by new messages arriving in the subscribed HiveMQ topics. I assume that as long as messages are being published to these topics, theAzure function will be triggered and remain active. But I may be wrong, I have no experience with Azure Functions yet.","",""
"867075936054149191","rickbullotta","2023-12-19T20:52:43.5820000+08:00","Not sure that’s possible without someone writing a HiveMQ extension or unless there’s a stateful app listening on a subscription.  It should  be possible using Event Grid though.","",""
"1073620930636550276","alejandrosimo","2023-12-19T21:05:38.3500000+08:00","Thanks! I didn't know that with Event Grid you can directly subscribe to HiveMQ without some other service in between, I will take a look","",""
"817835202746253344","IIoT#4707","2023-12-19T21:05:38.6910000+08:00","GG @Alejandro, you just advanced to level 2!","",""
"867075936054149191","rickbullotta","2023-12-19T21:07:16.7150000+08:00","I don’t think you can do that actually - I think you’d need your site HiveMQ to publish to Event Grid’s optional MQTT broker","","👍 (1)"
"867075936054149191","rickbullotta","2023-12-19T21:07:56.7520000+08:00","https://learn.microsoft.com/en-us/azure/event-grid/mqtt-overview","",""
"873009180938743828","sim_sam3","2023-12-20T00:13:52.8380000+08:00","Also check out Azure IoT Ops - easy-ish integration from edge mqtt broker to event grid and other azure services: https://azure.microsoft.com/en-us/products/iot-operations","","👍 (1)"
"783917475128410112","geoffnunan","2024-01-05T12:02:44.7170000+08:00","We are working on it now. Would be great to compare notes","",""
"343452320216121345","hanno23","2024-01-10T14:30:20.6310000+08:00","I have implemented a couple of IIOT projects for remote pump station etc, but we now have a client in the food and beverage space that wants his Ignition SCADA in the cloud (AWS). Our S88 standard is pretty heavy, we are looking at 60k-100k tags. I was thinking of doing the following:
Siemens PLC <---OPCUA--->Ignition Edge<---MQTT SpB--->EMQX Broker (EC2)<---MQTT SpB--->Ignition Perspective  (EC2)

I am familiar with AWS and Terraform so it shouldn't be too difficult. I was just wondering:
1) Has anyone done this before? Any gotcha's I need to look out for? Things like tag count limitations, MQTT aspects that could mess with the standard SCADA control process.
2)I am thinking of running the broker and Ignition on one EC2 instance and the Historian DB on another EC2 instance. Once we are done with comissioning and happy with EC2 sizes, I'll apply EC2 Reserved instances to save money. This feel to me like the best solution in terms of cost. I know there are other costs like R53 that I need to take into considderation but am I missing anything major? Is there a better solution ito cost?","","👀 (2)"
"817835202746253344","IIoT#4707","2024-01-10T14:30:21.0180000+08:00","GG @Hanno, you just advanced to level 1!","",""
"890244048739270656","brianpribe","2024-01-12T23:17:44.7400000+08:00","I would be very careful with running your SCADA in the cloud. You must do what you can on maintaining connection or redundancy to prevent your SCADA control from going offline.","","💯 (4)"
"890244048739270656","brianpribe","2024-01-12T23:22:55.6270000+08:00","Ask specifically why the customer wants SCADA in the cloud. SCADA doesn't typically need the features that cloud services offer like scaling up to 100X. MES is typically the line where OT services move to the cloud and it's typically due to the business having multiple locations.","","💯 (1)"
"230441548653789184","r.pop","2024-01-13T08:10:14.4360000+08:00","Is it actually a SCADA? or are they using Ignition Perspective for Visualization in the cloud?","",""
"528668306690015284","vatsalshah","2024-01-14T10:15:20.3140000+08:00","This and we are underestimating security risk involved for running scada in the cloud. None of the scada systems are cloud native - that means they never isolated frontend and backend neither they authorize every call.  Securing that attack surface forever is not a small feat.","","💯 (2)"
"343452320216121345","hanno23","2024-01-15T20:43:34.2030000+08:00","Jip that is the point I made as well, the client is ""high"" on cloud and I explained to him that there is no advantage (in this case) to run the SCADA on site vs in the cloud.  The SCADA controls a critical process and adding an IOT layer to that does not make sense. I explained it to the client and was basically told that we should still do it and if it does not work out, move it back to site. So at this stage I am just trying to make sure that I implement it in the best way possible although I don't agree with the design.","",""
"867075936054149191","rickbullotta","2024-01-15T22:39:52.4250000+08:00","Make sure that you have no liability exposure as well.  It's a dangerous approach they're taking.  Or say ""no"".  You'd be doing them a favor.","",""
"890244048739270656","brianpribe","2024-01-15T22:46:30.7360000+08:00","I hope it’s not gonna be any worse than Jurassic Park’s SCADA. Give the movie a rewatch and you’ll see what I mean.","",""
"343452320216121345","hanno23","2024-01-16T00:57:42.4940000+08:00","Jip at this stage I am just making sure I spec the edge PC so that it can run the whole SCADA (If they plan on moving it back) and setup TLS/SSL in the MQTT layer. But I am going to make it clear to him that he is now introducing a new point of failure.","","🔥 (1),👍🏼 (1)"
"343452320216121345","hanno23","2024-01-16T00:58:50.1790000+08:00","😂  I will check it out.","","🔥 (1)"
"693309801589112862","_dyland","2024-01-16T03:07:59.7990000+08:00","https://jurassicsystems.com/","","😂 (1)"
"890244048739270656","brianpribe","2024-01-16T08:31:39.1600000+08:00","HOLY CRAP!!","","🤣 (2)"
"1129435706285101076","ted.garrison","2024-01-18T21:41:15.7580000+08:00","hah.. now next time I decide to rewatch that, I'm going to actually be paying more attention to their infrastructure architecture than the movie itself.. THANKS A LOT>","",""
"890244048739270656","brianpribe","2024-01-18T22:56:21.3730000+08:00","Hey I couldn't help myself and now you all must bare the consequence 😂","","😂 (2)"
"442331638727311370","giulianog_","2024-02-05T22:59:18.3590000+08:00","hey @everyone i am a cloud vendor and we have this software that is very similar to an ERP but we call it the MRP3. we have only been in the market for 7 months and want to see what other people think about the software so we can keep growing and make it better","",""
"442331638727311370","giulianog_","2024-02-05T22:59:31.9410000+08:00","here is the login to the demo if anyone is interested","",""
"442331638727311370","giulianog_","2024-02-05T23:02:34.3250000+08:00","https://demo.ajawmrp.com/","",""
"442331638727311370","giulianog_","2024-02-05T23:02:39.4770000+08:00","AdminDemo","",""
"867075936054149191","rickbullotta","2024-02-06T03:00:59.3280000+08:00","I would highly recommend not doing this - you just gave us an Admin account - and the first thing I was tempted to do was to change the password....","",""
"766684226455207996","bright_hummingbird_31342","2024-02-06T04:17:57.8130000+08:00","I thought it was some sort of bot.","",""
"442331638727311370","giulianog_","2024-02-06T05:57:17.9880000+08:00","I own the plat from so its fine i can just change it","",""
"442331638727311370","giulianog_","2024-02-06T05:59:04.4890000+08:00","but your right","",""
"817835202746253344","IIoT#4707","2024-02-06T05:59:04.7910000+08:00","GG @giulianog_, you just advanced to level 1!","",""
"442331638727311370","giulianog_","2024-02-06T05:59:22.7500000+08:00","@everyone DM me if you want access to the MRP3","",""
"867075936054149191","rickbullotta","2024-02-16T19:28:00.8330000+08:00","Oops.  https://www.theregister.com/AMP/2024/02/15/microsoft_retires_azure_iot_central/","","🤔 (1),👀 (1)"
"1073620930636550276","alejandrosimo","2024-02-17T00:27:10.7420000+08:00","What alternative withing Azure would you suggest to people that were using IoT Central?","",""
"867075936054149191","rickbullotta","2024-02-17T00:39:14.2290000+08:00","That's a tough one - I personally like Azure Digital Twins quite a bit, but there's no clear committment to its future either.  That could be easily addressed.  And I'm told that there's a replacement for IoT Central coming at some point.  Utterly shocked that they would announce Central's demise without also announcing any pending alternatives.","","👍 (1)"
"657361690379288596","du5tins","2024-02-21T00:43:23.9390000+08:00","This might be a little off topic but not sure where to ask this question or start a discussion on it. Is anyone in this community following the Broadcom take over of VMware? Losing ESXi free license last week feels like a huge loss. What is the next evolution of on-prem cloud for OT? XCP-NP or Proxmox?","",""
"1129435706285101076","ted.garrison","2024-02-21T00:57:56.7570000+08:00","we've been moving from VMWare to Nutanix over the last year or so.  Beyond that, I know nothing, as it's all IT doing it..","",""
"657361690379288596","du5tins","2024-02-21T00:59:59.1810000+08:00","We work on some larger DCS style systems with on-prem virtualization for the SCADA/HMI servers and historians. Emerson DeltaV, Rockwell, and others have been mainly recommending VMware for such deployments to date. If the cost structure of VMware changes a lot I can see these vendors changing things up a bit.","",""
"766684226455207996","bright_hummingbird_31342","2024-02-21T01:47:59.8260000+08:00","It's been a while since I've looked at the ESXi licensing stuff, but I don't remember it being significant relative to the resources required to stand up, say, a SCADA or DCS solution.  It seemed like Microsoft and Cisco was always the source of complications on how to optimally balance licensing, architecture, and requirements.  Will the VMware license changes, beyond not being free, have a significant impact?

Industrial vendors are slow and like stability.  Outside of industry, the market has been shook up in recent years.  Unlike a decade ago, there is a lot more than VMware now.  VMware is mature technology that will continue to be relevant for years, but it has a lot of competition.  Organizations too lazy to buy anything other than Microsoft have been migrating to Hyper-V for quite some time.  Also, the cloud services and containerization have diminished the role of hypervisors.  Ted also mentioned Nutanix AHV.

The tricky thing will be is if vendors are still deploying applications as ESXi images and only offering support as such.","",""
"568913935147728896","zeratall","2024-03-03T21:49:57.9910000+08:00","Anyone using InfluxDB Serverless MS? I'm using Azure which is V2. My architecture diagram is below:","https://cdn.discordapp.com/attachments/740336311671586968/1213845829664776212/image.png?ex=68df2bc5&is=68ddda45&hm=16e73c89d57cbb179a2cc60ba51d7ff77f175bca9f6ac6f4074e9d83f5e3fd49&",""
"568913935147728896","zeratall","2024-03-03T21:51:37.5760000+08:00","The problem I'm having is the InfluxDB writer is subscribed to my MQTT UNS, and writes data to InfluxDB when topics update (topics update at different rates because I'm reporting on exception only). The problem is it's a few thousand messages/second, because of this, the data that is published via mqtt is not instantly available in InfluxDB, the latency grow as the load grows.","",""
