AuthorID,Author,Date,Content,Attachments,Reactions
"876880919988957205","ryankershaw","2022-07-07T21:44:52.8420000+08:00","These guys offer some good technology: https://sensourceinc.com/  I used to do some work with them years ago, and always liked what they provided.

A standard camera could also work.  If it's a small room, an easier method might just be to see if the room stays occupied for longer than a certain amount of time, rather than trying to detect motion or no motion.  That said, an occupancy sensor combined with a motion sensor, both commercial level stuff, could give you the info you are looking for at a low cost.  If the occupancy sensor says someone is in the room, but the motion detector hasn't picked anything up for 'x' minutes, this could be an alarm point.","",""
"174217472856031232","narkara","2022-07-09T04:52:17.9580000+08:00","","https://cdn.discordapp.com/attachments/841346396639723553/995069840480022528/20220708_163054.jpg?ex=68dee601&is=68dd9481&hm=ff4e5d3bfb57006209ee73d33a59b6ebdbfe0b03c0fb72bab761795cad168a83&,https://cdn.discordapp.com/attachments/841346396639723553/995069840924610660/20220708_135559.jpg?ex=68dee601&is=68dd9481&hm=ab253f746ada441cac4ca51c90f977680b03b28484991c1624ea6088c4a90b1a&",""
"174217472856031232","narkara","2022-07-09T04:53:06.3430000+08:00","Today i tried testing out a New pressure sensor, wich is better for chemical substances","",""
"867075936054149191","rickbullotta","2022-07-11T06:26:57.6290000+08:00","Ring Camera. Done.","",""
"972729012570964008","ivangap.","2022-07-15T11:22:07.8300000+08:00","Anyone using Centrica’s wireless sensors?
They come with their own bridges which connect to centrica’s cloud analytics. We want to take the data wirelessly (from the wireless sensor to the bridge), connect wirelessly to the bridge, bring the data to our UNS and send it to our own AWS analytics using and MQTT payload. I was able to do it using a wired connection to the bridge but not wirelessly. I have a number of these bridges which connect to an even bigger number of wireless sensors. Wired connections to each bridge would be costly","",""
"817835202746253344","IIoT#4707","2022-07-15T11:22:08.2260000+08:00","GG @ivangap., you just advanced to level 2!","",""
"403511800068440074","rafaamaral","2022-07-15T16:15:04.5920000+08:00","I use Banner wireless sensor. Absolutely love them. Not sure how they compare with centricas. Would be interesting to know their price point.","",""
"972729012570964008","ivangap.","2022-07-16T01:18:07.1140000+08:00","These are legacy equipment that we already had when we started our 4.0 initiative. Not sure I would recommend them. They work fine if you use their own clowd analytics. I’m still retrying to find a way around to extract the data wirelessly into my UNS and use in my own analytics","",""
"972729012570964008","ivangap.","2022-07-16T01:22:02.5440000+08:00","Anyone using IFM SD9500 air sensors? I want to extract consumption data but I am getting flow. Can I extract consumption or would I need to use a formula to figure it out?","",""
"917925131261718558","jpmoniz","2022-07-16T03:58:28.6810000+08:00","I use other similar ones. Thought you can kick them into totalizer mode.  Is that model I/o link based?","",""
"829502128191045652","joshuastover","2022-07-21T00:09:48.0860000+08:00","What are some good sensor options to gather temperature, humidity, and barometric pressure? I'm using a raspberry pi 3 B+ in a weather proof container. I've done testing with the sense hat and a dual fan hat (to get the sense hat to read remotely accurately) and tested the DHT11. Maybe something that can be exposed to the elements as I will deploy the device full time outside.","",""
"867075936054149191","rickbullotta","2022-07-21T00:27:55.3790000+08:00","Phidgets.","","👍 (1)"
"773659998751686687","joshp2148","2022-07-21T02:19:39.3970000+08:00","I'm a fan of Lora sensors and either a standalone gateway or a Lora Hat for the RPi. Depends on how frequently you want to get data from the sensors, how many sensors, where they're placed etc.. but dragino( https://www.dragino.com/products/temperature-humidity-sensor.html) makes some decent low cost outdoor temp/humidity sensors. Might be overkill for what you are looking for though.","",""
"815267392905150465","venkyiaf753280","2022-07-21T23:43:07.7240000+08:00","Hello Friends! 
I need some information on type of sensor to be used to measure the thickness of any transparent sheet like glass with measuring accuracy of 0.05mm. 
Thanks 🙏","",""
"898217314741280828","hobbes1069","2022-07-22T04:20:47.1450000+08:00","I'm trying to think of alternative methods of tracking production of a press. I can't take it offline for any significant amount of time and the maker recommends not trying to talk to the OLD AB PLC directly.","",""
"898217314741280828","hobbes1069","2022-07-22T04:21:31.7250000+08:00","My first thought was to layer an Opto 22 groov (Rio or EPIC depending on the number of inputs needed) over the existing I/O, and I still think that's a good way to go but will take time to integrate.","",""
"898217314741280828","hobbes1069","2022-07-22T04:22:08.9550000+08:00","I'm thinking a prox sensor would work, but I have no clue what type to use. Inductive? Capacitive? Magnetic?","",""
"876880919988957205","ryankershaw","2022-07-22T04:40:40.1760000+08:00","Glass thickness might be possible by measuring the refraction of a light source, though off the top of my head I can't think of anyone that would do that.  Ultrasonics might be a good option, especially in a production environment, since they shouldn't have issues with dust.  As for who, here's a good one: http://www.vninstruments.com/products.htm  His website isn't great, but he's one of those guys that knows absolutely everything about that measurement method and has done some really cool stuff with it.  Definitely reach out to him, the guy's name is Ian Neeson.","",""
"876880919988957205","ryankershaw","2022-07-22T04:47:09.7250000+08:00","If you have access to the two sides, a magnetic proxy sensor on one side, and a permanent magnet on the other side to activate it should work well.","",""
"898217314741280828","hobbes1069","2022-07-22T04:48:28.4500000+08:00","Ok, I'm betting the tool steel is magnetic (ferrous) but not a MAGNET. I wasn't sure if a magnetic prox switch needed a magnet or just a magnetic material.","",""
"876880919988957205","ryankershaw","2022-07-22T04:55:01.0930000+08:00","I think most of them need a magnet.  Was trying to find some info, but the company I used to deal with doesn't sell proxy sensors anymore, and they used to be a good resource.","","👍 (1)"
"815267392905150465","venkyiaf753280","2022-07-22T07:00:33.7120000+08:00","@Ryan Kershaw thank you","","👍 (1)"
"867075936054149191","rickbullotta","2022-07-22T21:48:29.4660000+08:00","Does it have to be non-contact? Two spring loaded rollers and a linear or rotary transducer?","",""
"815267392905150465","venkyiaf753280","2022-07-22T22:26:36.9670000+08:00","Non-contact would be ideal.","",""
"770068706247180309","tgchip_1235","2022-07-22T22:30:13.6290000+08:00","Here is a sensor that can be used to measure the thickness of transparent materials: https://www.micro-epsilon.com/displacement-position-sensors/confocal-sensor/","",""
"817835202746253344","IIoT#4707","2022-07-22T22:30:14.0120000+08:00","GG @tgchip_1235, you just advanced to level 1!","",""
"815267392905150465","venkyiaf753280","2022-07-22T22:33:22.3570000+08:00","Thanks very much. I shall definitely explore the options.","",""
"867075936054149191","rickbullotta","2022-07-22T23:39:25.8480000+08:00","Just remember you can always take a distance measurement from fixed, calibrated locations on both sides  and do the math!","",""
"812295088348200960","patanj2","2022-07-23T05:10:29.6290000+08:00","I will add to this that fully understanding measurement uncertainty is important if you do it this way.","","👍🏼 (2)"
"571815818308878347","binyameen_980","2022-07-25T01:29:46.9630000+08:00","I do not have much experience with sensors and data acquisition on production floor so need ideas.
Situation is there are around 4000+ stitching machines on production floor and I need two things, one, which part operators has worked on and, second, how many pieces each operator/machine has worked each day.","",""
"571815818308878347","binyameen_980","2022-07-25T01:31:18.7730000+08:00","Possibility of RFID to track individual pieces and final product is also under consideration.","",""
"571815818308878347","binyameen_980","2022-07-25T01:31:50.5680000+08:00","Any ideas will be helpful 🥺","",""
"867075936054149191","rickbullotta","2022-07-25T01:49:30.9170000+08:00","Do you really need unit level tracking? RFID tags (even passive tags) would add to your cost per unit.  Barcodes would likely be a better option.","",""
"571815818308878347","binyameen_980","2022-07-25T02:40:51.9340000+08:00","This is what others suggested, I do not agree with them. RFID on the final product can be delivered to the customer too.
I am working on feasibility of merging cutting and stitching. It has huge advantages and little disadvantages.","",""
"571815818308878347","binyameen_980","2022-07-25T02:41:55.3080000+08:00","Right now I am looking for an economic and efficient way to to acquire stitching floor data","",""
"867075936054149191","rickbullotta","2022-07-25T03:47:48.2690000+08:00","I would think that $0.10 per unit would be a significant add in the garment business.  Plus thousands of readers and their maintenance.","",""
"571815818308878347","binyameen_980","2022-07-25T03:51:33.2790000+08:00","It was untill Customers asked to add their RFIDs at packing stage, so this $0.10 won't hurt much. Additional reader cost and maintenance cost is the real problem","",""
"571815818308878347","binyameen_980","2022-07-25T03:53:30.0700000+08:00","that is why i am looking for an economic and reliable solution specifically at stitching floor","",""
"867075936054149191","rickbullotta","2022-07-25T03:55:40.4580000+08:00","Are there any computers or other devices at each station today?","",""
"571815818308878347","binyameen_980","2022-07-25T03:57:30.4100000+08:00","There are a few PCs at each floor which Industrial Dept uses to generate reports like efficiency, productivity etc.,","",""
"571815818308878347","binyameen_980","2022-07-25T03:59:02.8630000+08:00","These PC will be replaced by Tabs one we are able to acquire data automatically and an MES is up and running so reporting will be automatic","",""
"867075936054149191","rickbullotta","2022-07-25T04:00:19.1850000+08:00","If you need a scanner and interface at each of the 4000 stations you may want to consider cheap Android phones.  You could use 2D or 3D barcodes or NFC tags.","",""
"571815818308878347","binyameen_980","2022-07-25T04:03:21.7750000+08:00","scanner at 4000 stations is an option, and I do not need interface at each station. Interface is necessary at each floor, not on every station","",""
"571815818308878347","binyameen_980","2022-07-25T04:05:17.4260000+08:00","at 4000 stations I only need two things to get recorder automatically, one, how many pieces were produced at each station a, second, which work order pieces operator has worked on","",""
"867075936054149191","rickbullotta","2022-07-25T04:55:53.5020000+08:00","You’ll almost certainly need some type of interface.  At a minimum a way to confirm scan success or failure or if the data was valid or invalid(eg unknown tag, duplicate tag, etc).  A cheap phone as a scanner would work best because you won’t need to run comms wiring if you have good Wi-Fi.  And you get an interface.  You might want to consider hiring a systems integrator with experience in these types of tracking and data collection systems so you don’t buy 4000 of the wrong tech.","","👍 (1)"
"740383178279354388","mriiot","2022-07-25T05:44:30.0870000+08:00","What does part presentation look like, is there a way to capture cycle start and cycle end?","",""
"894527802316046366","nickn5549","2022-07-25T15:36:55.0760000+08:00","or Raspberry Pi ZeroW + Pi Camera running Node-Red for scanning and data entry + maybe a USB button for counting pieces","","👍 (1)"
"277515221885779970","jermuk","2022-07-25T16:08:26.6760000+08:00","We did it a couple of times using light barriers, which is easy to install from outside as you can mount it fairly outside, and it will give you all required information about the machine state and how much was produced. Maybe a magnetic switch additionally for maintenance doors or something like this to deep dive into the cause for machine downtime","",""
"571815818308878347","binyameen_980","2022-07-26T00:57:18.8260000+08:00","I did not find one locally.","",""
"571815818308878347","binyameen_980","2022-07-26T00:57:39.3490000+08:00","and it's great advice. Thanks","",""
"571815818308878347","binyameen_980","2022-07-26T00:58:31.2280000+08:00","Nope. Parts are just cut pieces of fabric ready to get sewed.","",""
"571815818308878347","binyameen_980","2022-07-26T01:02:42.2300000+08:00","Will it be reliable when it will be running for 16 hours daily?","",""
"571815818308878347","binyameen_980","2022-07-26T01:03:20.9620000+08:00","Does anyone remember that ""Pockit"" dude, he can make me a solution easily xD","",""
"867075936054149191","rickbullotta","2022-07-26T01:40:28.2430000+08:00","Times 4000?  I’d go with a cheap Android phone.","","👍 (1)"
"917925131261718558","jpmoniz","2022-07-26T03:28:52.2630000+08:00","At that scale I’d probably do the same or a cheap android tablet. One clean package and device management would like be way cleaner.","","👍🏼 (2)"
"894527802316046366","nickn5549","2022-07-26T06:47:38.0790000+08:00","RPI ZeroW are cheap and reliable... are about 10bucks USD. And pi cameras, if you find them are around 30 bucks. Nod-Red is free and the stand + enclosure can be 3D Printed. If your budget permits go higher - tablets, smartphones, etc. It's a Node-Red for Android now....it's a few bucks and is pretty cool","","👍 (1)"
"894527802316046366","nickn5549","2022-07-26T06:49:09.8470000+08:00","I have around 20 x RPI ZERO W in production, attached to temperature, CO2, PH sensors that are working 24/7 for more than 3 years now without any failure","","👍 (1)"
"894527802316046366","nickn5549","2022-07-26T06:50:55.6810000+08:00","I have also old RPI2 that are doing the same for more than 6-7 years now without failure...the only thing that ever failed was a few microSD cards. Just cloned new ones and up you go.","","👍 (1)"
"930806556566650961","alex_g_m","2022-07-26T23:10:23.3500000+08:00","Nick, have you used the Pi Pico for any projects?","",""
"894527802316046366","nickn5549","2022-07-27T05:26:34.3800000+08:00","No, I stopped at Zero as the smallest one","",""
"867075936054149191","rickbullotta","2022-07-27T11:29:08.4920000+08:00","The Pi Speck is the new cool thing.","https://cdn.discordapp.com/attachments/841346396639723553/1001692692322992198/IMG_1553.jpg?ex=68df4304&is=68ddf184&hm=1d407bd7970dc415c8da82d0305898372a550e5f6f05a697cb0b2b13e177d2fa&",""
"894527802316046366","nickn5549","2022-07-27T16:21:03.0430000+08:00","no, no, no Pi Dust are the coolest things...","https://cdn.discordapp.com/attachments/841346396639723553/1001766153439416340/unknown.png?ex=68dedeae&is=68dd8d2e&hm=1923ae1992c2767b70cfbb882fd7172f444430f29acdc2d8e4c37f31384db21f&",""
"794020366536146977","mparris","2022-07-27T19:16:34.5930000+08:00","Are those the new versions with power over Ethernet using single pair Ethernet???","",""
"487658368492896257","benveenema","2022-07-27T19:39:51.4230000+08:00","Pi Pico is a microcontroller (like Arduino), not a single board computer (sbc) like the other Pi's, Zero, 2/3/4, etc. Although you might be able to add a camera and read a barcode on a Pico, it would be a very heavy lift and really isn't the right tool for the job.

There's a lot of confusion around the Pico because RPi made it but my opinion is that for 99% of this audience, Pico is the wrong tool.","","👍 (2)"
"894527802316046366","nickn5549","2022-07-27T19:51:50.1360000+08:00","Wireless power Nikola Tesla style...","",""
"930806556566650961","alex_g_m","2022-07-27T21:17:06.6810000+08:00","Understood. Was just curious as to whether it can serve a purpose in any way on the shop floor (particularly the wireless model), considering it's cheap as chips and actually in stock 😅","",""
"740383178279354388","mriiot","2022-07-28T03:44:06.9110000+08:00","Can you hook up a sensor to the pi pico and have it stream mqtt?","",""
"740383178279354388","mriiot","2022-07-28T03:45:23.6950000+08:00","Like a banner or keyence sensor","",""
"277515221885779970","jermuk","2022-07-28T14:21:39.8160000+08:00","In my experience, I would recommend against using microcontroller in production scenenarios (except when you really know what you are doing and have enough time).
Just reading out data from I/Os can get quite difficult as you have to worry about timing (when to send messages, when to read data). You can start using an RTOS, but that does not fully address all issues.","",""
"277515221885779970","jermuk","2022-07-28T14:24:13.0800000+08:00","Also I would not recommend consumer hardware like the raspberry pi for anything critical. The electronics behind it are good enough for the IT World, but a raspberry pi will need maintenance around every 2 years, which is not what OT typically loves. Especially the SD card situation (SD cards are not designed for continuous read/writes. Even industrial SD cards don't come near the usual reliability required for OT)","",""
"277515221885779970","jermuk","2022-07-28T14:25:18.4820000+08:00","Then you have electrical engines frying your self-made microcontroller or causing otherwise weird behavior (restarts, memory corruption, etc)
And you will have certification issues as well.","",""
"277515221885779970","jermuk","2022-07-28T14:26:10.6120000+08:00","Though that as well, did that for around 1.5 years, threw that idea into the garbage bin and started using way more expensive, but in the end cheaper equipment from standard hatdware providers","","💯 (1),🙏 (1)"
"207687979060166656","mr.rippie","2022-07-28T20:20:18.9200000+08:00","What are your guys thoughts on wireless sensors? A device that is battery powered (can be designed for 10 year battery life), low cost, wireless and IIOT ready. It can be easily provisioned to a master PLC device receiving all sensor data and reporting it to the SCADA layer","",""
"740383178279354388","mriiot","2022-07-28T20:26:05.6410000+08:00","Like a protocol gateway?","",""
"207687979060166656","mr.rippie","2022-07-28T20:31:52.4880000+08:00","not exactly. these devices will communicate directly with a ""master"" PLC. i consider a master PLC a device that manages the connections of wireless sensor nodes that are connect to it. a master PLC can have upto 8 wireless sensor nodes connected to it (perhaps more depending on wireless protocol used). to your point maybe that master PLC can communicate to a gateway later to report all sensor data  and state changes but i'm thinking more controls level. gathering sensory data from processes wirelessly and a master PLC collects it and operates with that data accordingly. hopefully i cleared that up. curious to here everyone's thoughts","",""
"740383178279354388","mriiot","2022-07-28T20:32:57.9690000+08:00","So like io link but wireless?","",""
"207687979060166656","mr.rippie","2022-07-28T20:33:10.2400000+08:00","yes","",""
"207687979060166656","mr.rippie","2022-07-28T20:35:32.4760000+08:00","that is an easy way to put it. thanks! lol","",""
"817835202746253344","IIoT#4707","2022-07-28T20:35:32.8880000+08:00","GG @rippie, you just advanced to level 1!","",""
"740383178279354388","mriiot","2022-07-28T20:39:11.2800000+08:00","Would have to spec out delivery guarantees and accceptable latency","",""
"207687979060166656","mr.rippie","2022-07-28T20:46:58.9880000+08:00","definitely. typically wireless protocols have predetermined data rates and packet error control built into the network stack. there are somethings one could do as well to improve latency but that would be on a case by case basis","",""
"207687979060166656","mr.rippie","2022-07-28T20:51:50.7160000+08:00","@MRIIOT thanks for helping me simplify the description of the application here. wireless IO link pretty much summarizes my idea! but yea im curious what are peoples thoughts on something like this deployed in a manufacturing environment? it seems to me like it could save cost, reduce installation time, increase system flexibility whether it's size/dimensions or HMI and device management","",""
"745796393855352953","thedavidschultz","2022-07-28T20:52:47.5100000+08:00","Wireless sensors and transmitters are pervasive in process industries, specifically for asset health (vibration, ultrasonic). While they do provide more data it also means maintenance people will need to replace batteries as part of rounds. Not a huge deal when there are 50 sensors. Different challenge when there are 500. That said, the benefits are often worth it.","",""
"207687979060166656","mr.rippie","2022-07-28T21:02:22.2340000+08:00","@DavidSchultz thanks for your response! I'm curious, why do you say wireless sensors / transmitters are pervasive in process industries? and I hear you on the battery replacements. often these things are hard to access as well so it's important to limit the number of times an employee has to touch it. if i do design something like this i would target a 5-10 year battery life. also, what would you say the benefits are? i made some comments on my last message like save cost (due to less physical materials needed, wires, buttons, switches etc...), quicker installation, more system flexibility in terms of HW and SW. would you agree? would you add more to that? FYI I've never worked in a manufacturing environment so I may say something dumb and not realize it. i'm hoping i can glean from the more experienced manufacturing guys here to polish my ideas and views on what industry 4.0 should look like","",""
"867075936054149191","rickbullotta","2022-07-28T21:07:21.5780000+08:00","When estimating real world battery life, take the square root of vendor claims then divide by two.  The savings is in not running power or comms wiring, but you’ll need to replace batteries more often than you think.  Make sure you choose sensors that can publish their battery level so you can monitor it.  🪫","",""
"745796393855352953","thedavidschultz","2022-07-28T21:07:47.9900000+08:00","They are pervasive because I sell them 😀 

Most claim a 5 - 10 year battery life, but actual performance is not usually as good. Since the model has shifted from buying hardware to paying for a monitoring service, the providers will replace at their cost. But to your point, this still requires work from the plants. Nikola has a battery-free option so long as it is within 15 feet of the gateway. Happy to help, but it has become a commodity market.","",""
"207687979060166656","mr.rippie","2022-07-28T21:30:51.0500000+08:00","that's true. thanks for confirming the savings in running power and wiring. that validates it for me! typically battery life for these systems heavily depend on how much data you are sending wirelessly and how often the device needs to wake up and activate the radio to transmit a packet(s). wireless transmission takes a lot of power. vendors who promote a 5-10 year battery life i would ask them what they're assuming in terms of wireless transmission. usually it doesn't resemble what most application require and that's why they need to replace them more often","",""
"207687979060166656","mr.rippie","2022-07-28T21:31:35.7920000+08:00","thank you David. this was really insightful for me","",""
"815267392905150465","venkyiaf753280","2022-07-29T23:59:34.7880000+08:00","How about wireless and battery less sensors by powering up the sensors by  harvesting energy from vibrations, light, heat etc.","",""
"815267392905150465","venkyiaf753280","2022-07-30T00:01:23.6840000+08:00","I wonder how the car key batteries last for the entire life of the car. I haven't changed my car key batteries ever nor do they need a recharging. Amazing isn't it?","",""
"207687979060166656","mr.rippie","2022-07-30T00:26:25.4730000+08:00","i think some energy harvesting applications are good for low frequency reporting and sampling frequencies but once you get into the high performance sampling and data reporting its not possible without a battery.","",""
"207687979060166656","mr.rippie","2022-07-30T00:26:59.3050000+08:00","my guess is people just use them a few times a day and the few times a day they used it's consuming power for a matter of milliseconds","",""
"207687979060166656","mr.rippie","2022-07-30T00:28:50.3030000+08:00","what kind of applications do you think wireless battery less sensors would be good for given the energy constrains which limit sampling frequency (for sake of argument lets say 1 sample per minute)? i guess using a solar panel with a backup battery would work for higher performance sensing but those would only work well outdoors","",""
"745796393855352953","thedavidschultz","2022-07-30T01:44:16.7180000+08:00","I must be doing something wrong. I have to replace mine frequently.","",""
"867075936054149191","rickbullotta","2022-07-30T03:40:50.9610000+08:00","Ha. I have to change mine every 18-24 months.","",""
"794020366536146977","mparris","2022-07-31T01:57:21.8870000+08:00","Did you get the default poll/response car keys? Should have upgraded to the pub/sub ones 🤣","","😂 (2)"
"867075936054149191","rickbullotta","2022-07-31T06:42:42.3670000+08:00","There’s almost always a tight poll loop down there somewhere.","",""
