AuthorID,Author,Date,Content,Attachments,Reactions
"745796393855352953","thedavidschultz","2021-05-11T21:17:43.3710000+08:00","Great to see the sensors channel. I am working with a client that would like to know when a roller on a conveyor is turning (to detect product movement). They would like to know speed, but state may suffice. The client suggested an encoder which I am working with P+F on, but these require PLC configuration, which I am not familiar with. 

Curious if anyone has any suggestions. I thought about getting some kind of small gear that could be mounted to the roller and they use a photo eye to detect movement/speed. Something that output a current of voltage signal would be preferred. Thoughts?","","🔥 (1)"
"487658368492896257","benveenema","2021-05-11T21:29:59.5060000+08:00","How fast does the roller spin on average?","",""
"487658368492896257","benveenema","2021-05-11T21:30:28.6480000+08:00","Another though could be to but an accelerometer or gyro on it that would produce a contant current or voltage while spinning","",""
"487658368492896257","benveenema","2021-05-11T21:30:57.6100000+08:00","You could probably infer RPM from the g-force relatively accurately in addition to state","",""
"456226577798135808","Deleted User","2021-05-11T21:42:00.2290000+08:00","Powered or passive rollers?","",""
"194289793905983489","zackscriven","2021-05-11T21:45:43.7240000+08:00","Pinned a message.","",""
"745796393855352953","thedavidschultz","2021-05-11T21:48:50.6950000+08:00","Passive. The conveyor is moving sheets of material down a line. There are powered rollers, but these may be on even when product is not moving. The goal is to know when metal is moving (and they are producing product).","",""
"745796393855352953","thedavidschultz","2021-05-11T21:50:30.7920000+08:00","Not very fast...maybe 2 - 3 RPM. The material does not move very fast down the line.","",""
"487658368492896257","benveenema","2021-05-11T21:54:15.1400000+08:00","Accelerometer or gyro might not work well at slow RPM and you have the issues of the wires spinning or needing to go wireless. I think you could use a single toothed gear that passes a photo-eye every revolution (basically the index channel on an encoder) and maybe pair that with a physical, delay-off timer so that the signal stays high for the amount of time a revolution should take and gets re-triggered every cycle.","",""
"487658368492896257","benveenema","2021-05-11T21:54:45.2510000+08:00","That's if you want or need to avoid a PLC. You could do the same thing inside a PLC.","",""
"745796393855352953","thedavidschultz","2021-05-11T22:26:57.7020000+08:00","@Ben Veenema Thank you for taking the time to chat with me about the application. Your help is much appreciated 🙏","","💯 (1)"
"745009912160976977","marioishikawa","2021-05-12T00:51:12.9620000+08:00","is it possible to use the actuator signal that allows/make the conveyor to move?","",""
"745796393855352953","thedavidschultz","2021-05-12T00:52:59.3730000+08:00","It is, but the conveyor may be on without product moving down it. Monitoring a static roller seems to be the best way.","","👍 (1)"
"840045073294819329","fredsoliz","2021-05-12T02:25:18.8330000+08:00","@DavidSchultz what if you made a mark on the conveyor, then train an image/video AI/ML bot to determine if there is movement","",""
"745796393855352953","thedavidschultz","2021-05-12T02:27:10.5420000+08:00","Thanks, Fred. Current plan is to use reflective tape with an optical sensor.","",""
"740531920907010118","jmckeon","2021-05-12T02:34:59.6550000+08:00","@DavidSchultz can you share any pictures of the process...also check dorner conveyors....I'll pull up the web link in a mo","",""
"840045073294819329","fredsoliz","2021-05-12T02:36:38.4380000+08:00","Practical","",""
"740531920907010118","jmckeon","2021-05-12T02:56:20.8520000+08:00","https://www.dornerconveyors.com/europe","",""
"740531920907010118","jmckeon","2021-05-12T02:58:01.8800000+08:00","They have drive elements and sensor I have used or should say adapted for different applications....but it was for small  carton or blister products in pharma","","👍 (1)"
"740531920907010118","jmckeon","2021-05-12T03:05:00.8900000+08:00","@DavidSchultz if the length of the product is consistent and you know it you could use a optical sensor to detect to leading edge and stay active until the trailing edge this will.guve you time per unit which yiu can use to calculate the speed and the number if units also and variable between units...there are a number of them from omron or keyence simple to use....","",""
"740531920907010118","jmckeon","2021-05-12T03:05:59.4330000+08:00","You could also go for a small camera sensor from sick or keyence or omron","",""
"740531920907010118","jmckeon","2021-05-12T03:07:00.9950000+08:00","They come with a usb or rj45 interface for laptop configuration with free software download","",""
"740531920907010118","jmckeon","2021-05-12T03:07:44.1690000+08:00","Stemmer is another great source for camera tech ...they will also help you select the right tech for the application","",""
"740531920907010118","jmckeon","2021-05-12T03:08:21.5150000+08:00","If you want to talk through the application just let me know","",""
"805550636481118208","jonnywright4","2021-05-14T04:53:54.4910000+08:00","My thoughts would be to detect the product rather than look at an inferred input. A simple light beam sensor with a reflector mounted on the opposite side of the conveyor could suffice. I've used this method successfully quite a few times.","","👍 (2)"
"766684226455207996","bright_hummingbird_31342","2021-05-14T05:49:10.9050000+08:00","If the product(s) on the conveyor are more ambiguous, vision could be an option.  Here's a similar application with pattern detection in MVTec Halcon.  You could derive the speed by scaling a line- or area-scan camera to its position relative to the conveyor.
https://www.youtube.com/watch?v=qTy7ainEz6c

Another option is to use a photoelectric distance sensor.  You could count the ""jumps"" in displacement.  If the product is length is uniform or there is some indicator mark on the conveyor, it could be used like an encoder.
https://www.youtube.com/watch?v=WhBwMqcPo-A","","👍 (2)"
"832550246961512479","beng1740","2021-05-18T03:44:29.7290000+08:00","Hey @DavidSchultz we design conveyors all the time and use an inductive proximity sensor picking up on a 6 flags in a star shape mounted to the non-driven end. It was important to us to measure the non driven end to pick up slip. Encoders are ok but have additional maintenance compared with the simplicity of the proximity. PM me if you want a picture of the setup we use.","",""
"815267392905150465","venkyiaf753280","2021-05-18T19:59:48.9020000+08:00","The speed/motion of rotating object can be sensed by a non-contact inductive type sensor. Metallic flags of specified dimensions can be mounted on the rotating object and the sensor probe can be installed with its sensing face in close vicinity of the rotating object. When these flags pass across the face of the probe, the frontal radiated EM field of the probe is damped which is converted to a corresponding output pulse.","",""
"749728132298178643","cryptolover7068","2021-05-18T20:50:11.3080000+08:00","Any wireless sensors for the industrial floor - Pressure, Temperature, Vibration, Flow, Distance with Sparkplug B on board?","","👍 (1)"
"745446887745781828","dundo6741","2021-05-19T03:55:25.1120000+08:00","BME688 4-in-1 Environmental Sensing with Artificial Intelligence
Bosch Sensortec's BME688 sensor is developed for mobile and connected applications where size and low power consumption are critical requirements


Applications
Indoor and outdoor air quality measurements
Bad breath or spoiled food detection
Diaper state detection, e.g., for baby care
Early detection of bad smells
Wildfire detection
Detection of unusual gases and smells that might indicate a leak or fire
Home appliances
Internet of Things (IoT) products
Smart homes
 😄

https://www.bosch-sensortec.com/products/environmental-sensors/gas-sensors/bme688/","","👍 (2)"
"727965710772600894","phil_s2342","2021-05-19T03:57:50.5430000+08:00","Can you share a picture to the board here? Would be great to see star shape with the prox sensor.","",""
"832550246961512479","beng1740","2021-05-19T08:26:45.2470000+08:00","@DavidSchultz This is for a bulk material conveyor but same principles. Hopefully the picture shows the star shape profile welded to the side of the drum well enough and location of proximity. We found this good as it is simple and easy to maintain.","https://cdn.discordapp.com/attachments/841346396639723553/844370456973803580/image0.jpg?ex=68df1844&is=68ddc6c4&hm=dee2f2642ea5c66c8a4b2e5c8c67c8e698e2da9b9abd458a914fce765a59fca0&","👍🏼 (1)"
"756565963520081950","andersgustav","2021-05-19T13:43:16.7430000+08:00","We do this all the time, as rotaryencoders just won't last in the touch enviroment with salt water and detergents.

Here is one fresh from the watercutter (need to replace the nozzle from the looks of it), that has a little higher resolution","https://cdn.discordapp.com/attachments/841346396639723553/844450113501265931/IMG_20210519_071633_edit_1238231967018351.jpg?ex=68df6274&is=68de10f4&hm=d95b1aac6acb9bfc6e6f76ecf4c079ab344f740dc1dfde4e1dc4384080eb0801&","👍 (2)"
"817835202746253344","IIoT#4707","2021-05-19T13:43:16.9940000+08:00","GG @Anders Gustav, you just advanced to level 6!","",""
"832550246961512479","beng1740","2021-05-19T14:31:24.0380000+08:00","Looks good @AndersG#7083. Do you use IO link proximities? I have looked into them and haven’t quite yet justified their extra cost for the self diagnostics.","",""
"756565963520081950","andersgustav","2021-05-19T14:50:34.1000000+08:00","Haven't got around to IO-Link yet (just don't have the time atm), just standard sensors.","","👍 (1)"
"745796393855352953","thedavidschultz","2021-05-19T19:00:00.1680000+08:00","Thanks @BenG The application only has rollers and not a belt. The rollers are about 2"" - 3"" in diameter. I suspect we could use a small gear in a similar fashion, but I am concerned about dirt fouling the optical sensor. This is why we thought an encoder would be a better option. Thoughts?","",""
"756565963520081950","andersgustav","2021-05-19T19:38:28.9570000+08:00","I never use optical sensors for these type of applications, actually I only use optical sensors only if I absolute have to (counting products or such). Anything that can be solved with a inductive sensor and a flag or similar are better.
IMHO.","","💯 (1)"
"745796393855352953","thedavidschultz","2021-05-19T20:54:33.7810000+08:00","Oops. I missed the inductive part. That would resolve the environmental concern. I will look into these.","","👍 (2)"
"832550246961512479","beng1740","2021-05-20T03:22:43.3210000+08:00","Some inspiration on how you could mechanically mount it. Replace the encoder in the picture with the star wheel.","https://cdn.discordapp.com/attachments/841346396639723553/844656333177225237/image0.jpg?ex=68df79c2&is=68de2842&hm=1185a7ccf93a90a89225b56009faa2a74b37a18f1b718f89ec8bbcc5b9d2b316&","uns (1)"
"807682982109904925","ericschummer","2021-05-23T23:56:03.3730000+08:00","we have sensors that can measure  3axles and vibration, which are used for predictive maintenance ..  also I believe monnit  has some that could be used easily ..  we are master delaers aof all , in case  you need pricing or anything","",""
"807682982109904925","ericschummer","2021-05-23T23:59:36.1080000+08:00","we use loranwan sensors for  3axial, vibration, temp, sound, ultrasound","",""
"740531920907010118","jmckeon","2021-05-24T07:07:06.4010000+08:00","https://www.staalinstruments.com/","",""
"749728132298178643","cryptolover7068","2021-05-24T20:53:19.0840000+08:00","@senzary.com-EricSchummer Great, I'll check Senzary out.","","💯 (1)"
"194289793905983489","zackscriven","2021-05-25T00:18:51.0050000+08:00","Thank you @senzary.com-EricSchummer","",""
"807682982109904925","ericschummer","2021-05-25T02:35:53.6070000+08:00","This is cool. Balckberry is selling a radar based sensor that estimates volume in a container or truck once you close the door","","👍 (1)"
"817835202746253344","IIoT#4707","2021-05-25T02:35:53.9290000+08:00","GG @senzary.com-EricSchummer, you just advanced to level 3!","",""
"744564195173073048","miklosbath123","2021-06-03T17:47:11.5510000+08:00","Cloud ready firmware platform provider https://golioth.io/  allows device makers to enable cloud connected IoT","",""
"194289793905983489","zackscriven","2021-06-04T03:37:29.7420000+08:00","Pinned a message.","",""
"851070946931769355","sourabhlearn1950","2021-06-07T14:24:55.5400000+08:00","Hi, How to connect Siemens PLC with python to read /write data ?","",""
"194289793905983489","zackscriven","2021-06-08T00:20:52.3670000+08:00","I would leverage the MQTT Function Block and an open source broker like Mosquitto or something!","",""
"194289793905983489","zackscriven","2021-06-08T00:20:57.3850000+08:00","Pinned a message.","",""
"711186774629679166","faithware101","2021-06-08T01:29:11.5910000+08:00","snap7","","👍 (1)"
"851070946931769355","sourabhlearn1950","2021-06-08T02:49:10.4670000+08:00","Snap7 not working with python 3.9","",""
"711186774629679166","faithware101","2021-06-08T05:06:56.5990000+08:00","Python 3.9 is relatively new, why don't you use python 3.5 or 3.4?","",""
"745446887745781828","dundo6741","2021-06-08T06:18:42.1050000+08:00","I've used OpenOPC library, with Python 2.x.
You need OPC DA server for that to work, I had Siemens Simatic Net.
OpenOPC has a small memory leak that can be dealt with though ...","",""
"849226844800286771","duncanct","2021-06-16T00:07:39.1160000+08:00","I am picking items for a IO-Link starter kit. ifm only have the IO-Link + 4-20mA version of a sensor. I see from the data sheet that there are 2 DO on the pure IO-Link version and 1 DO on the hybrid IO-Link/4-20mA version. Practically what do you lose by having 1 less DO on the hybrid version.","https://cdn.discordapp.com/attachments/841346396639723553/854391714524430346/unknown.png?ex=68df4c0a&is=68ddfa8a&hm=cb6517283a6aedc2553cf0643c47c6bfe06671809007ebaa86bbbee91e059e1a&",""
"194289793905983489","zackscriven","2021-06-18T11:44:52.0920000+08:00","@JBean","",""
"194289793905983489","zackscriven","2021-06-18T11:45:10.3160000+08:00","We are Going to be getting you guys IO link starter kits at a special Mentee Rate","","👀 (1),👍 (5)"
"456226577798135808","Deleted User","2021-07-12T15:36:57.5540000+08:00","Anyone an example of IIoT sensors (industry grade)? A type or brand. Looking like a flow or temperature meter. Ideally with both IIoT gateway AND 'legacy' electrical DCS / PLC connection.","",""
"801911564378046475","garthb_","2021-07-13T22:25:42.9240000+08:00","@Deleted User  you may want to look at monnit.com  - I have no personal experience but we are looking for a wireless temp sensor for on line sampling and they have a potential fit - their edge gateway does MQTT and they also have a modbus gateway","",""
"519283075507814400","mariopoetazus","2021-07-13T22:43:23.0080000+08:00","https://www.twtg.io/products/","",""
"519283075507814400","mariopoetazus","2021-07-13T22:44:09.6840000+08:00","My company use this sensors. We like so much their product, that we bough part of the company 😂","","😋 (1)"
"456226577798135808","Deleted User","2021-07-13T23:05:05.6980000+08:00","@GarthB  and @Mario Pereira  thanks for the replies I will look in to them.  Maybe I look at things wrong at this level. Most sensors (except above examples :-)) require a connection to a PLC/DCS OR are wireless and connect to a gateway. But none seem both.","",""
"519283075507814400","mariopoetazus","2021-07-13T23:05:32.3850000+08:00","yes and no","",""
"519283075507814400","mariopoetazus","2021-07-13T23:05:45.4420000+08:00","in our case sensor is connected to DCS","",""
"519283075507814400","mariopoetazus","2021-07-13T23:06:35.5010000+08:00","in short: It goes to LoraGateway, which has OPC UA server running, our edge solution then gets the data through OPC UA Client, normalizes it and sends it to DCS.","",""
"519283075507814400","mariopoetazus","2021-07-13T23:06:49.0680000+08:00","normalization associates asset id and stuff","",""
"519283075507814400","mariopoetazus","2021-07-13T23:06:54.4550000+08:00","and tag ids","",""
"519283075507814400","mariopoetazus","2021-07-13T23:07:00.2350000+08:00","and other things","",""
"519283075507814400","mariopoetazus","2021-07-13T23:07:44.7750000+08:00","In our case DCS its DeltaV 14","",""
"817835202746253344","IIoT#4707","2021-07-13T23:07:45.0780000+08:00","GG @Mario Pereira, you just advanced to level 11!","",""
"519283075507814400","mariopoetazus","2021-07-13T23:07:50.8960000+08:00","which has OPC UA too","",""
"519283075507814400","mariopoetazus","2021-07-13T23:08:20.6040000+08:00","our edge is the middle in the man that does the data normalization using MQTT and AWS Lambdas at edge (AWS Greengrass)","","👍 (1)"
"519283075507814400","mariopoetazus","2021-07-13T23:09:30.0350000+08:00","we have around 20k valve sensors per site, because alot of valves are still human operable valves instead automatic operable valves.","",""
"456226577798135808","Deleted User","2021-07-13T23:19:13.9320000+08:00","I will look into it. So it seems that a (for ex. flow) sensor that has 2 outputs (1 old school electrical to plc/dcs) and 1 ethernet connection with config for MQTT for example does not (yet?) exist. I guess if it is connected to dcs.. well you already have it too.","",""
"745446887745781828","dundo6741","2021-07-14T02:55:50.2690000+08:00","I'm looking for a handheld barcode scanner that connects to WiFi network.
It doesn't have to be fancy with display and keyboard. It's just for scanning barcodes.
Is there such device on the market?","",""
"487658368492896257","benveenema","2021-07-14T02:59:41.7860000+08:00","I don't know of a particular device, but I worked with Diamond Technologies a few years back and they were very responsive. https://www.diamondt.com/products/barcode-reading-solutions/barcode-readers-hand-held/

You might have luck reaching out to them.","","👍 (1)"
"740364653724434543","emileackbarali","2021-07-14T22:36:01.3630000+08:00","Very interesting. A LoraGateway with OPC UA server running on it. Nice.","",""
"740383178279354388","mriiot","2021-07-15T21:07:04.8450000+08:00","Like this?  https://shop.m5stack.com/products/atom-2d-1d-barcode-scanner-kit","",""
"740383178279354388","mriiot","2021-07-15T21:12:32.1340000+08:00","Or like this? https://koamtac.com/","",""
"740383178279354388","mriiot","2021-07-15T21:13:40.7600000+08:00","KDC350 is what I am thinking","",""
"194289793905983489","zackscriven","2021-07-20T23:15:50.3360000+08:00","Pinned a message.","",""
"861503879925858324","hadwll_","2021-07-25T18:10:49.8410000+08:00","Hi Team, I'm looking for a sensor to monitor vibration, perhaps temp as well. 

I specifically am looking for a product that is open in such a way that the user can somehow access the raw data.

Can anyone recommend?!","",""
"745796393855352953","thedavidschultz","2021-07-25T18:46:08.7110000+08:00","Is this for asset monitoring? There are a number of triaxial vibration and temperature monitors available. Most will give you raw output for analysis (FFT). Others have a ML/AI component.","",""
"861503879925858324","hadwll_","2021-07-25T19:46:57.9350000+08:00","Hi David, yes asset monitoring. Have you any suggestions of a manufactuter","",""
"841257308172320789",".leehunt","2021-07-26T06:10:28.5030000+08:00","What is the general POV on IO-Link and IO-Link wireless?  I can see the tech being valuable for OEM's and certain manufacturing processes but was wondering if large controls vendors are adopting the standard or developing their own competing systems.","",""
"487658368492896257","benveenema","2021-07-26T20:42:14.3530000+08:00","I think long term, it's going to be a big deal. Although it's been around for a few decades, it's still in its infancy for being used in a controls cabinet.

It needs a bit of standardization and manufacturers need to make it easier to get all the non-process data into your PLC. I think that will come, a lot of vendors already have function blocks for AB, it will just take time for that to make its way to the other PLCs.

A few downsides:
- It's a star topology, you cant daisy-chain sensors. This makes sense for standard analog sensors but not for a digital, sensor. No reason a bus couldn't be have been designed, but IO-Link was originally created for sensor manufacturers to update their settings on their sensors so a base sensor (example proximity sensor) could be tuned to different setting and then be different SKUs
- It's not built in to any PLCs

I think a different sensor bus technology could come along and replace these things. Ideally it would be an open standard and also specify things like standardized connectors (style and pinout) so that we can get closer to having the ""USB of Industrial devices""","","👍 (2)"
"817835202746253344","IIoT#4707","2021-07-26T20:42:14.7250000+08:00","GG @Ben Veenema, you just advanced to level 12!","",""
"745796393855352953","thedavidschultz","2021-07-26T20:43:33.6080000+08:00","Apologies for the slow response. There are a number of wireless sensors available that will provide reliability data. It all depends on the use case. The intent of the sensors is to enhance reliability which can be accomplished in several ways. 

If all you want is the data, there are many that will accomplish this. I am most familiar with National Instruments and Erbessd. The later has a number of different sensors that integrate into their visualization package.

The next level uses sensors that incorporate machine learning. These are connected to a cloud backend that provide visualization and alerts for asset health issues. Proaxion, Nikola Labs and Symphony Industrial AI all have good technology. Symphony has the most developed asset models along with the ability to include process data for process health, as well.

There are new technologies on the market that use ML at the edge. Rather than send a bunch of data for analysis, the bulk of it is done at the edge with a backend ML/AI performing additional analysis. The cloud also provides alerts and visualization. I am quite familiar with VIE Technologies for this.

Wireless vibration has become quite popular because it eliminates the need for a vibration technician to spend 20 hours per week gather and analyzing data. The sensors do the bulk of the work which frees up the technician to perform higher value work. Hope this helps.","","💯 (1)"
"841257308172320789",".leehunt","2021-07-27T02:17:51.0820000+08:00","@Ben Veenema @DavidSchultz Thank you very much for the feedback.  You definitely helped fill in some knowledge gaps.","",""
"861503879925858324","hadwll_","2021-07-28T03:31:39.0930000+08:00","Hi David,

Thanks so much for the detailed reply. I will check out NI really at that level I could look at developing my own sensor. 

I have thought about that, develop my   own visualations and alerts.

I will start with NI. If I find anything I will report back.

Thanks again!","",""
"194289793905983489","zackscriven","2021-07-31T05:03:03.6820000+08:00","IO link is exploding in number of devices… they are at the early part of a massive S curve.  I’m excited to get my hands on an Io link Master from Pepperl and Fuchs soon!!! They have a new Starter Kit!","",""
"194289793905983489","zackscriven","2021-07-31T05:04:30.0890000+08:00","Discrete sensors daisy chain makes me think of AS-Interface","",""
"818594389830926369","durgakolli2717","2021-08-05T03:16:50.1040000+08:00","FYI - check out FLUKE wireless vibration monitoring sensors too.","",""
"538677655000842260","na23909","2021-09-08T02:30:52.5850000+08:00","Yokagawa has great 'sushi' also","",""
"250015334604603392","tjvcagzgbyzh","2021-09-21T04:17:36.9110000+08:00","Not sure i'm in the right topic but anyway, are there classes regarding spB? Or Eclipse Tahu? I want to program ESP32 devices (Written in C) that would use spB. I've been looking for a while and except the spB specification, i can't find anything that specific that would help me understand the mechanisms enough to actually program this. My application can't have wired connections to my sensors ans space is critical. Ideally, i would even be able to use ESP8266 but with the TLS sercurity and the fact that i need fast read speeds, i doubt it. Thanks for the help! 🙂","",""
"740383178279354388","mriiot","2021-09-21T07:54:57.3190000+08:00","https://jpa.kapsi.fi/nanopb/docs/concepts.html","",""
"817835202746253344","IIoT#4707","2021-09-21T07:54:57.6690000+08:00","GG @MRIIOT, you just advanced to level 4!","",""
"740383178279354388","mriiot","2021-09-21T07:56:06.0480000+08:00","https://github.com/Cirrus-Link/Sparkplug/blob/master/sparkplug_b/stand_alone_examples/c/template_as_custom_props/example.c","",""
"250015334604603392","tjvcagzgbyzh","2021-09-21T21:39:27.5680000+08:00","Thanks! This will help a LOT! 
https://tenor.com/view/study-studying-estudiar-exam-examen-gif-17422429","","🧽 (1),😆 (2)"
"605751981297893376","luis_gastao","2021-09-22T22:55:40.5540000+08:00","Anyone is aware of any RFID reader that is MQTT spark plug B enabled ?","",""
"795178288330440704","youri.regnaud","2021-09-23T02:48:52.9310000+08:00","https://www.impinj.com/products/readers/impinj-r700 with MQTT client not SparkplugB. With Highbyte, Node-Red, … you can easily convert MQTT in SparkplugB","","👍 (2)"
"605751981297893376","luis_gastao","2021-09-23T03:40:15.0760000+08:00","Thanks @youri.regnaud","",""
"817835202746253344","IIoT#4707","2021-09-23T03:40:15.4610000+08:00","GG @Luis_Gastao, you just advanced to level 1!","",""
