AuthorID,Author,Date,Content,Attachments,Reactions
"343075694903033857","michael.brown","2021-04-13T06:12:42.4450000+08:00","I don't speak for AWS and have no knowledge of all the goings on in this space - but as an individual I think its interesting in that if you call something OPEN SOURCE and license it using OPEN SOURCE - then its OPEN, right?
Anyone at anytime can fork the OPEN code and do whatever they want....
Company A builds a business on Open source Apache Lucene and produces an opensource and enterprise version of Elasticsearch - then Company B decides to Fork the OPEN code and do their thing with it....Didn;t they both do the same thing? just a thought for conversation","",""
"745009912160976977","marioishikawa","2021-04-13T06:43:10.3500000+08:00","That's a very sensitive topic in which I personally have divided opinions. I appreciate your disclosure about your opinion. And I have divided opinions because if AWS invest in the code, then it's good for the community. On the other hand, it's bad for any for profit company in which the business model is to offer their solution on the cloud which is  very common case and it happens with companies like MongoDb and Elastic. There is a huge engineering investment and they cannot compete with the biggest cloud players specially when they also use it. So, nothing legally wrong but it can affect future decisions on open source ventures. What gets the attention is how AWS has been handling it. As stated by Elastic, it was even wrongly published in the past as a partnership with Elastic. So, not a personal or professional attack to you :), just sharing the discussion that has been happening.","","👍 (1)"
"745009912160976977","marioishikawa","2021-04-13T06:46:07.5720000+08:00","So in the case of companies like Elastic, MongoDb and Timescale they have the code as open source, but with a special license to avoid the competition with cloud providers. So basically you can do anything unless provide the platform as a hosted service.","",""
"745009912160976977","marioishikawa","2021-04-13T06:49:03.7310000+08:00","This is Elastic post on their license change. https://www.elastic.co/blog/why-license-change-AWS","",""
"698244484302897323","lmtx","2021-04-14T15:49:04.1370000+08:00","Great resource if you are interested in IoT deployments on the AWS cloud https://aws.amazon.com/architecture/iot/","","👍 (2)"
"817835202746253344","IIoT#4707","2021-04-14T15:49:04.3770000+08:00","GG @LMtx, you just advanced to level 3!","",""
"743347439972515894","mrjain.","2021-04-15T12:08:06.8090000+08:00","This is more hardware related but I didn't know where to put it - https://memfault.com/ Looks very interesting","",""
"795178288330440704","youri.regnaud","2021-04-21T11:55:09.4910000+08:00","My company's IT strategy for IT data analysis and storage is to use the Google Cloud Platform with big query, big table, Looker, ... Do you have any comments, recommendations, experiences on using GCP for OT/IT data analysis and storage? Our approach would be to collect data and structure in Highbyte UNS and push it into GCP via Google IoT Core. Thanks for feedback","",""
"698244484302897323","lmtx","2021-04-21T13:26:13.6590000+08:00","unfortunately I can help only with aws","",""
"698244484302897323","lmtx","2021-04-21T14:43:01.4490000+08:00","good material if you are interested in IoT at AWS https://aws.amazon.com/quickstart/architecture/iot-device-connectivity/","","🙏 (1)"
"828707787717476392","lukesmaul","2021-04-22T00:20:45.4000000+08:00","Hi @Andres Gonzalez Marcelo - did you end up moving to a different platform? I'm helping a customer evaluate Cumulocity, we see some of the same issues, but would like some alternatives.","",""
"815267392905150465","venkyiaf753280","2021-04-22T12:43:37.1400000+08:00","https://us02web.zoom.us/webinar/register/4616183914828/WN_cKXw6GXEQ4eoDT22xy64PQ","",""
"343075694903033857","michael.brown","2021-05-04T22:21:29.1230000+08:00","Ok, I'm deploying this right now in my account.. Just released:
https://aws.amazon.com/blogs/architecture/digitally-transform-your-factory-with-machine-downtime-monitor-on-aws/
All the code it opensource so you can see how its done - use it in your own solutions:
https://github.com/awslabs/machine-downtime-monitor-on-aws","","aws (5)"
"820097580665929808","pvmagacho","2021-05-05T20:19:04.9970000+08:00","Hi @Michael Brown I found Amazon Lookout for Equipments. Any example available like the one you just shared above 😀?","",""
"194289793905983489","zackscriven","2021-05-05T21:43:41.7160000+08:00","Amazing. I was looking into that. Would be interested in learning more / doing a podcast w/ @Walker Reynolds on the Channel to discuss all things AWS with Michael Brown.","",""
"343075694903033857","michael.brown","2021-05-05T21:49:39.6180000+08:00","@Paulo Vitor Here's a few items that may help.
A colleague of mine Michael Hoarau created a full walk-through demo for using Lookout for Equipment.
https://github.com/aws-samples/lookout-for-equipment-demo

And here's a blog post showing how to to use Lookout for Equipment and A2I (Amazon Augmented AI)
A2I is a automated pipeline service that can be added to ANY AWS ML workflow to add Human review and feedback to model training. : https://aws.amazon.com/augmented-ai/
Here's the blog:
https://aws.amazon.com/blogs/machine-learning/detect-abnormal-equipment-behavior-and-review-predictions-using-amazon-lookout-for-equipment-and-amazon-a2i/","","aws (2)"
"820097580665929808","pvmagacho","2021-05-05T22:03:39.4740000+08:00","Thank you very much @Michael Brown. Will take a look","",""
"820097580665929808","pvmagacho","2021-05-06T06:22:37.7930000+08:00","Hi @Michael Brown can we hook up a thermography camera into this https://aws.amazon.com/panorama/ ?Example: https://www.flir.com/products/ax8-automation/","",""
"343075694903033857","michael.brown","2021-05-06T06:30:23.6690000+08:00","@Paulo Vitor  Short answer is yes. Panorama appliance uses RTSP protocol to ingest video - so in the config when you add a camera - you would point it to the RTSP URL of the local FLIR Camera.  Based on the Flir specs :
Ethernet/IP, Modbus TCP, TCP, UDP, SNTP, RTSP, RTP, HTTP, ICMP, IGMP, sftp, SMTP, SMB (CIFS), DHCP, MDNS (Bonjour)
RTSP is supported","","👀 (1)"
"820097580665929808","pvmagacho","2021-05-06T06:31:57.1210000+08:00","Thanks. Do I need to send the data to the cloud or I can build a local application? I will read more about this product next week.","",""
"817835202746253344","IIoT#4707","2021-05-06T06:31:57.3730000+08:00","GG @Paulo Vitor, you just advanced to level 7!","",""
"343075694903033857","michael.brown","2021-05-06T22:04:56.8730000+08:00","AWS Panorama supports models built with PyTorch, Apache MXNet, and TensorFlow. The models run LOCALLY on the appliance but can be built and trained anywhere including Amazon SageMaker and import them from a SageMaker job or build/train yourself and upload to an Amazon Simple Storage Service (Amazon S3) bucket. For more information, see Computer vision models.","","💯 (1)"
"766684226455207996","bright_hummingbird_31342","2021-05-06T22:27:36.0450000+08:00","This is interesting. 

Is there some sort of gateway or appliance that connects to the cameras? Does this support GigE, USB3, and GenTL devices? 

2D only? 3D point clouds?","",""
"343075694903033857","michael.brown","2021-05-07T03:01:28.3090000+08:00","@js So if the camera platform supports 3D - we support labeling and training 3D Point clouds that can be compiled and pushed back down to the appliance.
https://docs.aws.amazon.com/sagemaker/latest/dg/sms-point-cloud.html

More specifically - Yes - There is an on-premise Panorama Appliance packed with a GPU for inference. It includes a Vision SDK and supports RTSP H.264 streaming cameras (think cameras already in place)

Upload video/images to AWS, use Sagemaker to train the model, compile the model - push the model down to the Panorama appliance for edge inference.","",""
"343075694903033857","michael.brown","2021-05-07T03:52:00.0490000+08:00","Or train your own model on your computer - then upload to AWS S3 - then the panorama appliance can pick it up from there and you can use the SDK for telemetry etc...","",""
"194289793905983489","zackscriven","2021-05-09T23:27:56.2900000+08:00","Free AWS Cloud Training Events on Twitch 😎
https://pages.awscloud.com/Global_traincert_AWS_Power_Hour_Cloud_Practitioner_FY21.html?sc_icampaign=event_twitch_certcp2_launch_tnc_global_traincert_200-cert&sc_ichannel=ha&sc_icontent=awssm-7790&sc_iplace=ribbon&trk=ha_awssm-7790","","ishocked (1)"
"456226577798135808","Deleted User","2021-05-12T17:15:15.3700000+08:00","Hi all! Let's say I have data in an Azure IoT hub and after doing some ""predictions"" I want to get that data back to my UNS. What would be the best way of doing that? I have Highbyte and an MQTT broker running. Documentation is... euh... not so clear for me. @Omar  Highbyte seems to have only outputs to Azure IoT hub how would Highbyte solve this? Or is their no other option then to develop a custom app that takes my data and provides it either through an endpoint or publish it to MQTT?","",""
"766684226455207996","bright_hummingbird_31342","2021-05-12T19:08:39.0700000+08:00","It’s been a while since I’ve looked at Azure IoT Hub. This may have changed. I always got the sense they made it easier to bring data into their ecosystem than out and not just because that’s what most use cases are.

In terms of egress interfaces, MQTT (and AMQP) is possible through an Azure SDK. OPC-UA is possible through the OPC Publisher or Edge products. These act as gateways that convert the native Azure message queues to OPC-UA at the edge. Unfortunately, these all have different throughput limitations and product skus.

I believe HB supports inbound OPC-UA, MQTT, and REST. You would need to leverage one of these interfaces. There is not a built in connector for consuming Azure.","","👍 (1)"
"756543760028139720","aronsemle","2021-05-12T21:16:10.6600000+08:00","Azure's Cloud to Edge story is a little less clear then AWS. Currently HighByte only supports Azure specific outputs, but it would be pretty easy to turn this around and support inputs as well. Where is the message coming from inside of Azure? Event Hub? Azure Function? What would be your preferred way to ingest it into HighByte? IoT Hub supports direct messaging but it's a little weird because it's treated like a remote method call. But HighByte could create an input that generates this method call. A more generic route would be to use an Event Hub, where you push to the Event Hub inside Azure and HighByte can listen on an input and pull the message down. Let me know, and we're happy to porotype something for you to try out.","","👍 (2)"
"194289793905983489","zackscriven","2021-05-13T07:42:36.7130000+08:00","Pinned a message.","",""
"194289793905983489","zackscriven","2021-05-13T07:44:49.7580000+08:00","Thanks for jumping in there @aronsemle & @js  I would echo what they said about bringing the context from cloud back down to edge being more cumbersome with Azure IoT versus a platform like AWS that supports MQTT SPB Publishing and Subscribing.","",""
"456226577798135808","Deleted User","2021-05-13T15:25:13.0970000+08:00","Sorry for the delayed response all. Thanks you @aronsemle and @js  for your input!
Since we are just doing pre PoC work (learning) I will need to have a better use case first. I’ll come back to you asap.","",""
"812295088348200960","patanj2","2021-05-15T21:18:31.7290000+08:00","@Michael Brown Thank you for sharing. I had seen the announcement, but also thank you very much for the link to the code used to implement.","",""
"812295088348200960","patanj2","2021-05-15T21:22:18.7820000+08:00","I've heard mentioned in some of the 4.0 Solutions videos @zackscriven  that AWS natively supports SparkPlug B. Is that in reference to the CirrusLink AWS modules for Ignition or is there a different core AWS IoT capability that I am not aware of?  @Michael Brown","",""
"343075694903033857","michael.brown","2021-05-15T22:35:29.8120000+08:00","@John Patanian both CirrusLink and Highbyte provide  a direct path from SpB to AWS' IoT core, sitewise and greengrass (highbyte)","","👌 (3)"
"807682982109904925","ericschummer","2021-05-16T06:38:19.4570000+08:00","Regarding the predictive maintenance my approach has been by Integration of lora specialized sensors( vibra, temp, ultrasound,,) and then from the iot mediation platform we  can route dynamically ( on demand) to unsupervised machine learning and micro trend series analytics, in addition to descriptive analytics and usage reports","",""
"807682982109904925","ericschummer","2021-05-16T06:38:38.2970000+08:00","Assembling as we speak 😋","",""
"194289793905983489","zackscriven","2021-05-17T00:38:50.1490000+08:00","Thanks for sharing Eric!","",""
"727965710772600894","phil_s2342","2021-05-19T04:43:09.7770000+08:00","What platform are you using/do you plan to host, run, and automate the unsupervised machine learning  programs? Commercial solution or in house specialty?","",""
"194289793905983489","zackscriven","2021-05-19T09:34:11.4430000+08:00","","https://cdn.discordapp.com/attachments/740336311671586968/844387425903706142/Screenshot_20210518-183331.png?ex=68df2812&is=68ddd692&hm=fb500fea1067d85ddb47c47d5446c06ec56049e6dd20638d39c53cd2aed34cf4&",""
"194289793905983489","zackscriven","2021-05-19T09:34:17.1270000+08:00","Pinned a message.","",""
"807682982109904925","ericschummer","2021-05-19T10:36:23.5730000+08:00","Its a mix. Same that ericsson uses  for its global network, suscribers, loyalty, promotions and churn","","👍🏼 (1),💯 (1)"
"807682982109904925","ericschummer","2021-05-19T10:37:36.0220000+08:00","I just integrated that with our iot mediation platform so we can route data in real time and on demand from sensor to "" virtual data scientist""","",""
"807682982109904925","ericschummer","2021-05-19T10:38:26.9800000+08:00","@Phil_S ..","",""
"698244484302897323","lmtx","2021-06-02T04:29:13.9220000+08:00","Hello, I created a post about the concept of AWS IoT Thing.

https://www.pexl.xyz/iot_thing/

I explain how to:

* represent a physical device (like a temperature sensor) in AWS IoT Thing Registry
* manage the metadata of IoT Devices in a consistent and scalable way
* organize IoT Devices in Logical Groups (for instance to efficiently manage all IoT Devices attached to the same piece of factory equipment)
* create the x509 Certificate and attach it to the IoT Thing as a proof of an identity

Let me know if this post was interesting for you!","","👍 (3)"
"798485298874679309","andyr8842","2021-06-02T06:30:56.7380000+08:00","this is most excellent @LMtx  fantastic work, more please 😄","","👍 (1)"
"743347439972515894","mrjain.","2021-06-02T11:26:10.2400000+08:00","Well done @LMtx for useful information!","","👍 (1)"
"698244484302897323","lmtx","2021-06-08T14:47:01.2500000+08:00","I recorded a video about this concept: https://youtu.be/4OlnMmtFO2Q","","👍 (2)"
"698244484302897323","lmtx","2021-06-08T14:54:53.3030000+08:00","by the way - do you prefer a blog posts or video content?","",""
"743347439972515894","mrjain.","2021-06-08T15:06:40.0100000+08:00","I prefer both 😆","",""
"698244484302897323","lmtx","2021-06-08T15:09:45.1290000+08:00","personally I prefer video for a short introduction to some new topic and blog post to get deeper understanding of some advanced concepts","","💯 (2)"
"698244484302897323","lmtx","2021-06-12T12:39:25.6090000+08:00","Anyone is using AWS Timestream to store sensor readings?","",""
"743347439972515894","mrjain.","2021-06-12T18:12:24.9710000+08:00","I tried it for a POC and decided against it. You cannot delete data. We ended up using MongoDB Atlas.","",""
"743347439972515894","mrjain.","2021-06-12T18:13:15.0070000+08:00","Timestream still feels like its in beta mode","",""
"698244484302897323","lmtx","2021-06-12T23:29:59.0910000+08:00","does Mongo support time series data type out of the box or you had to do some custom development?","",""
"743347439972515894","mrjain.","2021-06-13T13:21:27.6040000+08:00","We did have todo some custom dev on our end but I believe in most cases it just works out of the box. The solution is not as elegant as I like. IIoT Device -> IoT Core -> IoT Rules Engine -> AWS Lambda (for our custom processing) -> MongoDB Atlas","",""
"817835202746253344","IIoT#4707","2021-06-13T13:21:27.9670000+08:00","GG @mrjain., you just advanced to level 2!","",""
"743347439972515894","mrjain.","2021-06-13T13:23:24.4180000+08:00","AWS DocumentDB would have been a top contender but it somehow has a bad reputation for not being 100% MongoDB compatible","",""
"698244484302897323","lmtx","2021-06-13T13:40:20.0690000+08:00","have you used greengrass?","",""
"698244484302897323","lmtx","2021-06-13T17:00:16.2420000+08:00","btw you could use the store retention configuration to remove data from timestream (https://docs.aws.amazon.com/timestream/latest/developerguide/API_RetentionProperties.html)","",""
"743347439972515894","mrjain.","2021-06-13T17:28:38.3660000+08:00","I have not looked at Greengrass as of now","",""
"743347439972515894","mrjain.","2021-06-13T17:29:31.8250000+08:00","thanks. Yes, this is possible. But, if you want to delete some data for a device that is no longer on the platform you have to wait for the retention period to kick in.","",""
"698244484302897323","lmtx","2021-06-13T17:49:30.9870000+08:00","using greengrass you could move some processing to the edge and (in some cases) remove the need for executing lambda in the cloud","",""
"698244484302897323","lmtx","2021-06-13T17:51:50.6150000+08:00","please be aware that currently there are two versions of greengrass v1 and v2; I recommend you use the v2 (provided that it has features you need)
https://docs.aws.amazon.com/greengrass/v2/developerguide/what-is-iot-greengrass.html","",""
"743347439972515894","mrjain.","2021-06-13T17:57:36.6690000+08:00","Thanks, I'll check it out v2.","","👍 (1)"
"519283075507814400","mariopoetazus","2021-06-15T16:46:46.3730000+08:00","or use aws iot sitewise edge? 🙂","",""
"519283075507814400","mariopoetazus","2021-06-15T17:49:17.1740000+08:00","in case you are using AWS IoT, we have slack channel: https://join.slack.com/t/awsiotusergroup/shared_invite/zt-niz2av2t-Vuz3zQowBm7ye3hcp_P5KA","",""
"743347439972515894","mrjain.","2021-06-15T19:05:34.0400000+08:00","Thanks, I'll check it out","",""
"194289793905983489","zackscriven","2021-06-16T14:50:29.2440000+08:00","AWS EC2 Mac Instances https://youtu.be/d0FulqrjHkk","","aws (3)"
"698244484302897323","lmtx","2021-06-17T18:30:21.8300000+08:00","What do you think about multi-account (ingest, application, data etc.) design of AWS IoT deployment? Please vote in my poll. Any comments are very welcome 🙂
https://twitter.com/lmtx1/status/1405468352714350592?s=20","",""
"798485298874679309","andyr8842","2021-06-23T05:29:10.7480000+08:00","what is the benefit to having multiple accounts? Can you not already divvy up a single account using their user management system IAM?","",""
"798485298874679309","andyr8842","2021-06-23T05:29:49.9640000+08:00","or are you thinking more along the lines of if someone gets the root password","",""
"519283075507814400","mariopoetazus","2021-06-23T05:34:04.2090000+08:00","security wise","","💯 (1)"
"519283075507814400","mariopoetazus","2021-06-23T05:34:12.4580000+08:00","if one device gets comprimessed","",""
"519283075507814400","mariopoetazus","2021-06-23T05:34:30.1610000+08:00","it could messs up all your iot data pipeline","",""
"519283075507814400","mariopoetazus","2021-06-23T05:35:04.1860000+08:00","in my case for example, i have 1 account per type of env","",""
"519283075507814400","mariopoetazus","2021-06-23T05:35:43.4220000+08:00","in one of my previous company (PaaS) every customer had is own account","",""
"798485298874679309","andyr8842","2021-06-23T05:45:50.7330000+08:00","what does somebody get by compromising your device?","",""
"798485298874679309","andyr8842","2021-06-23T05:46:10.2330000+08:00","is there an AWS token being stored there?","",""
"519283075507814400","mariopoetazus","2021-06-23T05:48:18.4850000+08:00","certificates","",""
"519283075507814400","mariopoetazus","2021-06-23T05:48:20.4710000+08:00","MQTT","",""
"519283075507814400","mariopoetazus","2021-06-23T05:48:27.1260000+08:00","ANDDD your code","",""
"519283075507814400","mariopoetazus","2021-06-23T05:49:03.3640000+08:00","so many things that can fail","",""
"519283075507814400","mariopoetazus","2021-06-23T05:49:07.0030000+08:00","S3 buckets?","",""
"519283075507814400","mariopoetazus","2021-06-23T05:49:19.8880000+08:00","🙂","",""
"519283075507814400","mariopoetazus","2021-06-23T05:50:00.3440000+08:00","for example, if you use Greengrass you can use AWS Secret Manager connector","",""
"519283075507814400","mariopoetazus","2021-06-23T05:50:23.0790000+08:00","which encrypts for example credentials","",""
"519283075507814400","mariopoetazus","2021-06-23T05:51:03.6760000+08:00","imagine your device gets compromised and you are not encrypting your credentials or putting to logs in plain text","",""
"519283075507814400","mariopoetazus","2021-06-23T05:51:18.4490000+08:00","(already saw that happening, looking at linksys)","",""
"519283075507814400","mariopoetazus","2021-06-23T05:52:02.5290000+08:00","and imagine that you use the same password for all devices in the same accounts","",""
"798485298874679309","andyr8842","2021-06-23T05:55:57.9220000+08:00","Can you specify different passwords for individual devices under a single account?","",""
"519283075507814400","mariopoetazus","2021-06-23T06:03:00.2150000+08:00","you can, but still you will have alot of entries in secret manager, which can be hard to maintain. Even if you use CloudFormation or Terraform. You will get overloaded","",""
"519283075507814400","mariopoetazus","2021-06-23T06:03:42.9390000+08:00","or you use OAuth with Google etc etc  for your devices and you put the auth responsibility elsewhere","",""
"519283075507814400","mariopoetazus","2021-06-23T06:04:09.6050000+08:00","but that is an exemple why some people go to multi account in aws","",""
"519283075507814400","mariopoetazus","2021-06-23T06:04:18.6800000+08:00","for example with Google Cloud","",""
"519283075507814400","mariopoetazus","2021-06-23T06:04:39.9530000+08:00","you dont have multiple accounts, you have projects. Which are under the same account","",""
"519283075507814400","mariopoetazus","2021-06-23T06:04:50.8830000+08:00","and its way easier to maintain","",""
"519283075507814400","mariopoetazus","2021-06-23T06:05:02.8210000+08:00","i dont know about azure","",""
"798485298874679309","andyr8842","2021-06-23T06:06:25.6310000+08:00","interesting cheers","",""
"519283075507814400","mariopoetazus","2021-06-29T17:29:25.5420000+08:00","https://www.youtube.com/watch?v=9tGbszPf_po my presentation about edge computing using aws iot for iiot is now on YouTube","",""
"851540984289951754","thewurstusername","2021-06-30T00:39:53.1290000+08:00","Was InfluxDB not a contender? Or were you looking for a managed service?","",""
"743347439972515894","mrjain.","2021-06-30T13:49:29.9320000+08:00","I was looking for a managed service","",""
"519283075507814400","mariopoetazus","2021-06-30T15:13:14.2500000+08:00","interesting, we do the same 😄","",""
"519283075507814400","mariopoetazus","2021-06-30T15:13:43.8460000+08:00","you use the aws lambda caching mechanism right?","",""
"519283075507814400","mariopoetazus","2021-06-30T15:14:34.1040000+08:00","by the way, do you leave all data in Atlas or you clean it after a while?","",""
"743347439972515894","mrjain.","2021-06-30T16:41:19.8700000+08:00","We have not looked at Lambda caching as of now. We leave all the data in Atlas.","",""
"519283075507814400","mariopoetazus","2021-06-30T16:41:36.0580000+08:00","not that, the auth with mongodb 🙂","",""
"519283075507814400","mariopoetazus","2021-06-30T16:41:53.1900000+08:00","alot of people i see using aws lambda with atlas, they dont cache connection","",""
"519283075507814400","mariopoetazus","2021-06-30T16:42:07.9350000+08:00","by the way, how do deal with lost messages?","",""
"519283075507814400","mariopoetazus","2021-06-30T16:42:15.4000000+08:00","e.g it reaches aws iot rule","",""
"519283075507814400","mariopoetazus","2021-06-30T16:42:21.3850000+08:00","if the aws lambda fails","",""
"519283075507814400","mariopoetazus","2021-06-30T16:42:28.2570000+08:00","you lose the message","",""
"519283075507814400","mariopoetazus","2021-06-30T16:42:39.9120000+08:00","do you send to SQS or Kinesis?","",""
"743347439972515894","mrjain.","2021-06-30T16:42:58.4030000+08:00","we are going to implement SQS for this","",""
"817835202746253344","IIoT#4707","2021-06-30T16:42:58.7440000+08:00","GG @mrjain., you just advanced to level 3!","",""
"743347439972515894","mrjain.","2021-06-30T16:43:05.9110000+08:00","but yet to do","",""
"519283075507814400","mariopoetazus","2021-06-30T16:43:25.4750000+08:00","nice we do SQS","",""
"519283075507814400","mariopoetazus","2021-06-30T16:43:35.0650000+08:00","we send to SQS messages that fail","",""
"519283075507814400","mariopoetazus","2021-06-30T16:43:39.7260000+08:00","and reprocess it","",""
"519283075507814400","mariopoetazus","2021-06-30T16:43:49.3130000+08:00","we putted aws cloudwatch monitoring","",""
"519283075507814400","mariopoetazus","2021-06-30T16:43:58.3850000+08:00","to know how many messages failed","",""
"743347439972515894","mrjain.","2021-06-30T16:44:39.8790000+08:00","oh man, that's exactly the setup we want to implement!","",""
"743347439972515894","mrjain.","2021-06-30T16:45:13.3820000+08:00","We have not because we have not really had an issue with Lambda....YET","",""
