AuthorID,Author,Date,Content,Attachments,Reactions
"1181115443474342021","tibi_03551","2024-06-05T21:04:52.8640000+08:00","We have approx 5 halls, tens of meters distance between them, so some machines in teh same hall are  close to each other (4-20 m)","",""
"1181115443474342021","tibi_03551","2024-06-05T21:06:12.3410000+08:00","All lines have single items on conveyor belts, we are talking about car batteries and related components, production tact is seconds, sizes are tens of cm width/heigh/length","",""
"1181115443474342021","tibi_03551","2024-06-05T21:06:52.8210000+08:00","Thank you, we will take a look!","",""
"867075936054149191","rickbullotta","2024-06-05T21:22:20.6710000+08:00","An easy one then!  The main thing you'd need to do is debounce the photosensor so you don't get inaccurate counts.","",""
"697134502148964423","trentc","2024-06-07T17:33:47.0030000+08:00","You could consider banner snap, Ive never used it but it’s on machine io with a controller that claims it can be programmed and transmit via mqtt.

https://www.bannerengineering.com/us/en/products/connectivity-technology/snap-signal.html

https://youtu.be/8ZbsFxjKTW0?si=pbQ-WxxIv2JF7HaR","","❤️ (1)"
"1164510748744110121","jamesa_50833","2024-06-19T07:13:33.6620000+08:00","I'm looking for a similar solution to @Tibi . I have a heat sealer where I want to track the following:
Number of units coming through the heat sealer in a production run.
Power on / off state
Machine run time
Temperature setting on the heat sealer.
Conveyor Speed. 
Height setting 
Cooling fan status
Potentially power use

I'm not from an engineering background but am trying to skill up and this is the first small pilot project we want to implement to prove value.
We will engage support from a local firm if we need to, but I am interested in learning first and do have support to experiment.
The solution @trentc - 4.0 Hero LLC posted looks pretty good as a starting point but any advice is appreciated on where to start. 

This solution would also require the ability to pause the counter in cases where a pouch might need to be resealed, or some method to enter the number of resealed bags at the end of the run.","",""
"867075936054149191","rickbullotta","2024-06-19T22:03:43.3150000+08:00","@MRIIOT might have a nice option with Sharc","","👍 (2)"
"1214242167640424619","zack.scriven","2024-06-21T08:52:43.6520000+08:00","Thanks for the valuable reply Js.","",""
"442331638727311370","giulianog_","2024-06-27T03:17:58.3140000+08:00","@everyone does anyone know how to make a RFID box scanner I need it to connect to our software","https://cdn.discordapp.com/attachments/841346396639723553/1255602979378298950/bf078b07-2d24-4a37-89d0-27d4a50207c9.jpg?ex=68df78a6&is=68de2726&hm=02955a0a1d719152ad9b82153d16cae9852fc87badb937396469eef400d52593&",""
"697134502148964423","trentc","2024-06-28T07:42:33.5720000+08:00","You might need something more than the snap io… I can jump on a call to see where i can help. Message me if you want to chat.","",""
"740383178279354388","mriiot","2024-07-01T23:13:57.1870000+08:00","We tried snap , has to go through modbus, into a DXM, and then to mqtt.

Also we seemed to have fried a few.  Not sure why.","",""
"697134502148964423","trentc","2024-07-01T23:28:32.0350000+08:00","Thanks for the info. Yes it’s all based on modbus rtu…. Which is nice and universal but the con here is it also an older slower communication protocol. And yes that was my understanding too that it has to go through the dxm to get it to mqtt. Unfortunately there’s not a lot of documentation on mqtt for the dxm.","",""
"1129435706285101076","ted.garrison","2024-07-01T23:32:59.1710000+08:00","i've got a couple dxm1200's at my desk that I'm going to try the MQTT publish on at some point. Maybe this week after I wrap up a couple items. It *looks* easy enough..","",""
"1242074290510368854","jeffo_mt_90697","2024-07-08T20:58:45.2930000+08:00","Hi I am new to the thread and from Mettler Toledo - for web applications check IND360 we currently support OPC over EIP or PN. MQTT next year. OT IT connection is native no gateways","","👍 (3)"
"1121097877419212870","anirban2023","2024-07-10T14:02:25.8200000+08:00","Hi all, can you suggest any device/iot box that doesn't need to assemble and can be configured out of box using some UI from a laptop or desktop.","",""
"817835202746253344","IIoT#4707","2024-07-10T14:02:26.1680000+08:00","GG @Anirban Debnath, you just advanced to level 2!","",""
"1073312001788477471","sparkylarks","2024-07-10T14:30:57.9080000+08:00","what do you want the device to do?","",""
"1121097877419212870","anirban2023","2024-07-10T14:38:10.4970000+08:00","Collect data from a sensor (e.g. temperature).","",""
"740465837340623038","marc_akoto_autem","2024-07-10T18:10:15.5790000+08:00","Raw Thermocouple or RTD ? Any protocol conversion done natively by your sensor ? 

As a rule of thumbs, I would first list all Inbound and Outbound formats, protocols, measurements, ... 

Your IoT toolbox choice is a function of the other systems this device will interact with.","",""
"1073312001788477471","sparkylarks","2024-07-10T19:24:05.0150000+08:00","https://www.mriiot.com/sharc might work for you.
@MRIIOT","","💯 (1),🤔 (1),👍 (1)"
"867075936054149191","rickbullotta","2024-07-10T19:44:53.1840000+08:00","Phidgets.","",""
"740383178279354388","mriiot","2024-07-10T20:22:53.3870000+08:00","SHARC for sure.  It does not get any simpler.","",""
"898217314741280828","hobbes1069","2024-07-11T02:37:04.1770000+08:00","Yeah, for a single sensor SHARC is the way to go. For multiple inputs (and outputs) with very high flexibility, Opto 22 groov Rio is amazing.","",""
"1214242167640424619","zack.scriven","2024-07-11T05:13:55.1440000+08:00","thnak you for sharing!","",""
"798219851352899625","8elahr","2024-07-17T19:58:09.5540000+08:00","Hi Anirban, 
i can recommend the CMTK by Balluff. 
http://www.balluff.com/go/cmtk

it is a all in one box solution, where you can Connect any IO-Link Sensor of any vendor to one of the 4 Ports. The device Collects all the Sensor data by its self automatically, Stores the data in an on board influx DB. And generates automatically the basic Grafana Dashboards. 
In additon it comes with the Docker engine preinstalled, so you can spinn up any additional docker container of your choice. Node Red is the one most users use. 
The data is also published on an internal MQTT broker, so you can connect any other collection system to the internal data backbone.

The Config of the device is entirely done on your browser via the integrated web UI.","",""
"1073312001788477471","sparkylarks","2024-07-17T20:02:20.3400000+08:00","Worth looking into.

https://www.ifm.com/ie/en/shared/moneo","",""
"898217314741280828","hobbes1069","2024-07-18T01:49:12.1670000+08:00","Hate modern websites... Scrolled all the way down and learned nothing.","",""
"873009180938743828","sim_sam3","2024-07-31T04:48:40.0320000+08:00","anyone thinking about / playing with HTTP over Bluetooth-enabled devices?","",""
"873009180938743828","sim_sam3","2024-07-31T04:48:46.1320000+08:00","newish standard called WebBluetooth","",""
"873009180938743828","sim_sam3","2024-07-31T04:51:10.9400000+08:00","https://bluetoothle.wiki/web_bluetooth","",""
"795725198980677734","diederik9434","2024-07-31T15:26:51.6040000+08:00","Could someone confirm they are happy with their NCD.io sensor setups? 🙂 How do you use them exactly? How's the batterylife?
 I'm currently recommending this to a costumer Curious to hear some thirth party feedback!","",""
"769397045579481129","donpancoe","2024-07-31T20:17:14.2160000+08:00","Having worked with both HTTP and BLE separately, my first though was ""how do you get one of the heaviest protocols to work over one of the most bandwidth-limited channels?"" On looking at the linked material, I remembered that this is not *HTTP-over-BLE*. This is browser code, running on your smart phone, to control the BLE radio built-in to your smart phone to talk to other BLE devices near your smart phone. Results of this communication can be returned to the browser for further use in the app. Given that many smart phone apps are written in browser-based, cross-platform frameworks like Flutter, I'd guess that most of them interact with off-board BLE devices in this way.

If you are looking for ways to network a number of wireless sensors within your plant, you want to look at [BLE Mesh](https://www.bluetooth.com/learn-about-bluetooth/feature-enhancements/mesh/) technology. Since this is neither TCP nor HTTP based, however, you will need gateway devices to connect your sensor mesh to broader control or enterprise networks.","","👍 (1)"
"873009180938743828","sim_sam3","2024-07-31T23:58:18.4390000+08:00","wonderful feedback! thank you so much for sharing such great details.","",""
"873009180938743828","sim_sam3","2024-08-01T00:26:24.3430000+08:00","here is a precise discussion of the technology stack: 

""It's perhaps a misnomer to talk about HTTP over Bluetooth. That's not what's happening here. This is a three tier architecture, with very lightweight Bluetooth LE communication between (1) a Bluetooth device and a (2) dual technology Bluetooth and TCP/IP device, acting as a proxy, which then communicates the Bluetooth encoded request that it has configured within it, to a (3) remote HTTP server over TCP/IP.""

https://stackoverflow.com/questions/47511294/how-can-we-use-http-over-bluetooth-low-energy-ble","",""
"769397045579481129","donpancoe","2024-08-01T00:58:42.8200000+08:00","A quick read implies that using the standard [HTTP Proxy Service (HPS)](https://www.bluetooth.com/specifications/specs/http-proxy-service-1-0/) could be less labor-intensive than manually building point-to-point connections from each BLE sensor to whatever gateway device you are using. This seems similar to [6LoWPAN](https://www.geeksforgeeks.org/what-is-6lowpan/) in that it *appears* to give each BLE or other constrained wireless device an IP address, while acknowledging that these constrained devices and networks are not suitable for full TCP/IP implementation. BLE has the ""HPS Server"" and 6LoWPAN has the ""edge router"" to bridge the gap. Not knowing your intended application, maybe this has utility, maybe not.","","🙏 (1)"
"1088631859509989426","jpmac.s","2024-08-06T16:08:18.2020000+08:00","Any suggestions for power metering? Something that will go direct into Igniton. Mqtt etc","",""
"1088631859509989426","jpmac.s","2024-08-06T16:24:06.5660000+08:00","I was looking at the opto emu but do they come with cts?","",""
"1214242167640424619","zack.scriven","2024-08-07T07:57:05.8090000+08:00","yes! that was my first thought was the Opto 22 EMU","",""
"1214242167640424619","zack.scriven","2024-08-07T09:36:59.6770000+08:00","What is CTS?","",""
"1088631859509989426","jpmac.s","2024-08-07T09:37:59.5780000+08:00","Current Transformers , i managed to find them on their website.","",""
"1214242167640424619","zack.scriven","2024-08-07T09:38:07.6030000+08:00","ahh got it.","",""
"898217314741280828","hobbes1069","2024-08-07T19:40:39.7250000+08:00","I don't think they come with them because there's too many different situations that one won't work for everything, but they do sell them;
https://www.opto22.com/products/optoemu-act-0750-100","","👍 (1)"
"894527802316046366","nickn5549","2024-08-08T05:09:49.1520000+08:00","I'm making one with RPI, ADC and CTs...WIP I will show you","","👌 (1),👍 (2)"
"740383178279354388","mriiot","2024-08-13T12:01:04.8050000+08:00","https://www.contec.com/lp/daq-control/raspberry-pi-cpi-series/","","👍🏻 (2),🍇 (1),💯 (1)"
"894527802316046366","nickn5549","2024-10-03T19:00:30.8730000+08:00","my RPI one is up","https://cdn.discordapp.com/attachments/841346396639723553/1291354188663750696/image.png?ex=68df040e&is=68ddb28e&hm=30d14110445c9f676c6df2b8be5f14f0cc148442883be24413c6dd3ae6506def&","👌 (2)"
"697134502148964423","trentc","2024-10-03T19:15:03.2370000+08:00","You can integrate any that have a protocol in the ignition standard driver modules.

It’s fairly common to use modbus tcp in energy meters. 
Check out finder for some din rail energy meters.
Or banner has a nice design with the snap io CT using IOLink, where the master has modbus tcp.
Or if you prefer the PLC route, with either native protocol or mqtt, wago cc100 with their energy module, or Siemens S71200 with an energy module. But opto22 is probably the cleanest package and easiest to setup for mqtt.","","👌 (1)"
"1088631859509989426","jpmac.s","2024-10-03T19:21:06.8890000+08:00","Thanks Trent, we ended up going with the Opto EMUs, should arrive soon. Looking forward to having a play.","",""
"697134502148964423","trentc","2024-10-03T19:23:15.1470000+08:00","Good choice! You can always use the EMU to integrate more remote devices like analog channels and modbus TCP meters too….it won’t be as easy as the emu itself but it gives you scalable options","","👌 (1)"
"1088631859509989426","jpmac.s","2024-10-03T19:25:42.2710000+08:00","Our client was happy with the price , he didn't care what we used.","","🔥 (1)"
"1074874619380641852","mattshane","2024-10-04T03:59:17.6120000+08:00","Looking for an iiot temp sensor suggestions. I need to monitor oven temperature and log history.  Preferably something that can take a type K thermocouple input and publish MQTT.  Initially I just need a single input from a single oven, but I might eventually monitor power consumption as well.  It doesn't need to be wireless as I have device power and ethernet at the oven.","",""
"1129435706285101076","ted.garrison","2024-10-04T04:00:43.8050000+08:00","Opto22 Rio will do the trick nicely.   PoE powered, so you only need to run one cable.    Or maybe something from NCD.IO if you want battery powered, wireless..","","👍 (1)"
"1074874619380641852","mattshane","2024-10-04T04:09:01.1200000+08:00","I was hoping to keep the hardware cost under $500 but not finding much there.","",""
"1129435706285101076","ted.garrison","2024-10-04T04:12:38.0120000+08:00","https://www.mriiot.com/sharc  Maybe?  I'm not sure of pricing, but @MRIIOT can surely help out..","","👍 (1)"
"1088631859509989426","jpmac.s","2024-10-04T04:14:37.5480000+08:00","For that price point and looking for those capabilities you will struggle to find anything industrial spec.","",""
"1129435706285101076","ted.garrison","2024-10-04T04:14:40.6340000+08:00","Also, you can use quite a few inputs on the Rio, so even though it's a decent buck the first sensor, the follow ons are basically free.","","💯 (1)"
"1074874619380641852","mattshane","2024-10-04T04:22:46.5480000+08:00","The SHARC looks promising.  I would just need a amplifier for the T/C to get to a normal analog input.","",""
"1073312001788477471","sparkylarks","2024-10-04T05:06:08.2500000+08:00","what are you measuring the power of?

if you are going into Ignition , have put scores of the Schneider PM500 in over the years and they work really well. 
I've even added it as a requirement to every panel with 230V ins some plant's where I had that power
about €250","","👍 (1)"
"1088631859509989426","jpmac.s","2024-10-04T05:09:16.6140000+08:00","Power on the incoming 400A mains.  Are you using modbus to get it into igniton?","",""
"1073312001788477471","sparkylarks","2024-10-04T05:24:15.7190000+08:00","I've neve connected on to Ignition, but I've used Modbus to connect to PLC's or back to InTouch.
with Power meters you sort of pay for accuracy are you measuring to the 15th 31st or 63rd?
for standard industrial at 400A 15th is probably fine.

If you have a lot of Drives, or computer equipment , or if you are Arc welding, or have Arc furnaces you might have issues. but you'll probably be fine with any one you chose.

I tried looking for a MQTT native power meter and didnt; find anythign I woudl like to put in an Industrial setting. Bar the Groove EMU, but if your bringing it back to Ignition, it seams a bit over the top. If your publishing direct to a cloud broker then it;s the perfect tool","","👍 (1)"
"740383178279354388","mriiot","2024-10-04T20:25:45.0130000+08:00","Hey Matt.  Feel free to email me and I can demo the SHARC.  cmisztur@mriiot.com","",""
"740383178279354388","mriiot","2024-10-04T20:26:06.5450000+08:00","Thank you","",""
"898217314741280828","hobbes1069","2024-10-11T23:21:42.4050000+08:00","Hard to beat that price, but the Opto 22 groov Rio EMU would also work for about $1000, but has Node Red, MQTT, REST, and OPC UA on board.","",""
"1073312001788477471","sparkylarks","2024-10-11T23:24:30.9620000+08:00","100% there is a use case for the Opto22

But having an existing SCADA negates some of the advantages.

If I want to report all the power to the cloud and have some local data processing and dashboarding

So use node red to do some Data Ops and create a dashboard and then publish to a cloud broker.  perfect solution then.","","👍 (2)"
"1088631859509989426","jpmac.s","2024-10-12T06:24:20.2070000+08:00","Why wouldn't you use if you had an existing SCADA? I thought the whole benefit was how easy it integrates with Ignition.","",""
"898217314741280828","hobbes1069","2024-10-12T09:21:08.6530000+08:00","Can't speak for Mark, but I think it comes down to what you're comfortable with. If you are very comfortable with Modbus TCP, maybe the extra cost of a Rio doesn't make sense. It's always a ROI based decision between the solution cost and you're time (cost) to implement.","",""
"898217314741280828","hobbes1069","2024-10-12T09:22:15.2260000+08:00","For me, I don't come from a PLC (ladder logic, etc) background, and we're not in a penny pincher industry to the device cost is less important. I can put $5k on my purchasing card and my boss doesn't flinch. Other industries? Not so much.","",""
"1088631859509989426","jpmac.s","2024-10-12T09:47:26.9690000+08:00","Thats fair from a cost perspective its probably not the best option. But if the client's happy to pay i dont see the point of using mobus.","","👍 (1)"
"1073312001788477471","sparkylarks","2024-10-12T15:33:36.2570000+08:00","Happy to pay 1000 instead of 300. Ok

Now put 100 units in

And with a UDT to the same modbus map. Notuch additional work.

The cost calc for me is how many units can I put in for x","",""
"1088631859509989426","jpmac.s","2024-10-12T17:57:34.0300000+08:00","If im buying 100 im asking for a pretty good discount, but point taken. I dont understand what you mean with the modbus map , no touch additional work?","",""
"1073312001788477471","sparkylarks","2024-10-12T18:38:31.0080000+08:00","A power meter will typically have a Modbus map, which tells you what value is in what register, and what it's format is.

So if I have 100 Identical Modbus devices, especially one like a power meter where there are a lot of signals. I can take a lot of time to map the first one.
But once you have that done, the second is really quick. So If I came to site with no work done before hand,  to connect to 10 devices, Day 1 might be all bout connect in. on Day 2 might be connecting to the fist unit, and creating the dashboards and graphics. Day 3 - I might get most of the other 9 all collecting data and displaying it and storing to the historian, and Day 4 might be doing soe tidying up and validating.


So if I have a modern device that can save time, it works really well on one Device, but as I increase devices that relative saving drops.

Also, I was proposing this where there is already a Platform( SCADA typically) that can already connect to a Modbus devices. I can publish to my UNS from the SCADA, essentially using it as a IIOT Gateway. If I have to go and get a platform the strategy might change.

I also like to have a power meter that I can look at the front and see what the value is, and use that for validation.","","💯 (1)"
"898217314741280828","hobbes1069","2024-10-12T22:27:01.1450000+08:00","Another option then might be the EPIC which could monitor multiple machines/buildings/etc. Cost a lot more but if you monitor enough assets the per asset cost comes down. It has a touchscreen and HDMI output.
https://www.opto22.com/products/power-and-energy-monitoring","",""
"1073312001788477471","sparkylarks","2024-10-13T02:10:44.2350000+08:00","I'm not arguing that it is not an awesome product.

And for a single point @Josh Mac  I can't fault the choice. Will you report back and let us know how you got on.","",""
"1088631859509989426","jpmac.s","2024-10-13T03:52:20.7630000+08:00","You could make the exact same argument about setting up 100 Optos and possibly quicker with Spb.","",""
"1088631859509989426","jpmac.s","2024-10-13T03:53:26.2220000+08:00","Yeah im looking forward to setting one up, ill report back and let you know 😉","",""
"1073312001788477471","sparkylarks","2024-10-13T04:09:27.9530000+08:00","No.
my point was this
using the opto and SPB lets say it takes 1 hours to configure and get it running, and the subsequent devices take 1 hours. and it takes me 30 minutes to do my validation. 

Using a cheaper Modbus device( lets say $300), it takes me 10 hours.
so there is a clear advantage in using the Opto I have saved 8.5 hours  do the cost difference of $700 is worth it. ( assuming a hour cost of >$80 an hour)

when I go to 10 devices,  the Otto still takes me an hour and  half for each one. so 15  hours.
the Modbus first one still takes me 10 hours, but the subsequent ones  take me an hour and a half too. 
now the additional $7000  I am only saving 8.5 hours.

Lets say I am putting in 100 energy meters now.
Saving the 8.5 hours for a cost of $70,000 might not be worth it, I can think of a lot of thing I could do with that
Of course that also need an integrators who is skilled enough to create reusable templates,

Those figures are out of my hat, and of course the Opto's can do other things, so it comes down to ""It Depends""","",""
"1088631859509989426","jpmac.s","2024-10-13T04:20:37.5570000+08:00","Ah sorry i see the point you were making.","",""
"1073312001788477471","sparkylarks","2024-10-13T04:21:17.2430000+08:00","If I can't explain myself well enough to be understood, that is always my fault.","",""
"1088631859509989426","jpmac.s","2024-10-13T04:24:54.9650000+08:00","Modbus power meters in my experience have been slow to setup for sure. The SE ones i used are configured directly on the unit with no software GUI, were painful. Opto from what can tell will save alot of time in that regard.","",""
"1073312001788477471","sparkylarks","2024-10-13T04:34:27.0070000+08:00","That is a very fair point, especially if your don't have a background in power system. and I have done a lot of configuring on the front panel, 

Retrofitting a meter when you are not familiar with the meter can be a lot of time. but if you have a hundred of them you'll get faster.
TBH, If I am writing a distribution panel spec, I am putting in a power meter make and model, and something the panel builder will not complain about.
Again a very different use case to retrofitting a single power meter.","",""
"1088631859509989426","jpmac.s","2024-10-13T05:00:34.0060000+08:00","My use case for offering Opto EMU to my client , 1 - they didn't have a plc nearby and didn't want to interfere with they live process and lower costs of needing cables run. 2-Currently building them a igniton scada 3- i wanted to play with opto lol","",""
"1073312001788477471","sparkylarks","2024-10-13T05:22:10.4250000+08:00","So is it, Opto installed in the panel.
Connect to CT and voltage.
Ethernet to switch(wifi??)

Publish to Broker and consume in Ignition?

Nice approach.

Not sure what cables you save though?","",""
"1088631859509989426","jpmac.s","2024-10-13T05:35:25.0040000+08:00","Yep thats right, emu to broker to ignition. 

The opto will be in the panel on POE, CTs wired into the EMU.","",""
"1088631859509989426","jpmac.s","2024-10-13T05:36:43.4860000+08:00","Saving in regards to no power supplies needed or wiring into plcs","",""
"475955754788978688","jdingus","2024-10-16T09:18:46.1410000+08:00","Pressac has some really interesting MQTT enabled wireless power monitoring options that are powered by the cables they are monitoring (passively).  Some of the caveats are reduced resolution (30s readings) and a run on the enOcean so it requires a gateway which converts to Mqtt.

Per machine cost was sub $300 and installed in 10 minutes.","",""
"397074681141788672","simen13","2024-11-22T07:15:25.3150000+08:00","Anyone have experience with Shelly EM or Iammeter for monitoring machines off/on/running?","",""
"890244048739270656","brianpribe","2024-11-22T10:11:20.0610000+08:00","@Dylan DuFresne","","👍 (1)"
"693309801589112862","_dyland","2024-11-22T10:15:52.1470000+08:00","I haven't used one for any actual production equipment but I have used various Shelly devices with MQTT in my home lab. I also did a demo integration with some Shelly stuff and MQTT that might be helpful. 

We didn't show the Shelly configuration cause it was just following the instructions on their website. 

I did the demo live that took about an hour but since I really didn't know anything about recording it ended up getting corrupted... So we just talked through it.

https://youtu.be/FF5JIGSRILM?si=3oqnCLo2c4liz84z","",""
"397074681141788672","simen13","2024-11-22T17:02:52.3600000+08:00","Cool, I'll take a look at this","",""
"877337143742197810","karltbraun","2024-11-23T04:45:47.6540000+08:00","FWIW, I have some Shelly US smart plugs in my lab; used the default MQTT publication to my mosquitto broker, then subscribed and broke it up into flat MQTT for republication so I could do simple power graphs.","","😱 (1)"
"867075936054149191","rickbullotta","2024-11-25T19:57:57.8840000+08:00","Just remember that you’re giving an unknown Chinese company access to your WiFi network and credentials…","","👍 (1)"
