AuthorID,Author,Date,Content,Attachments,Reactions
"1073312001788477471","sparkylarks","2023-09-28T18:59:50.9050000+08:00","I am looking for a Sensor to measure theight of a stack of corrugated paper sheets. Sheets are a few mill thick.
At the end of the line the operator looks at the sheets and stacks them in a good and bad pallet. but there is now count
Longer term we are looking at weight but in the mantime, A laser distance sensor mounted above the pallet that measures the distance and converts it to sheets in each pile would give us a Quality figure to start with. 

Does anyone know of a MQTT enabled Distance Scanner?","",""
"894527802316046366","nickn5549","2023-09-28T19:04:40.5850000+08:00","You can make one with a ultrasonic sensor, python and a RPI...not sure how accurate should be, how thick are the sheets?","","👍🏻 (1)"
"1073312001788477471","sparkylarks","2023-09-28T19:13:25.0390000+08:00","1.5ishmm but the pallets are stacked to 700 sheets so about 1m high. 
I am not looking to be able to detect each sheet, but currently the quality figure is 100% so if I can get the no of bad sheets to 95% accuracy that is better.
I have a s7-1200 in the machine and can  4-20mA sensor in there. I have Ignition and Kepware on site so reading form Siemens no issue but was hoping for something simpler.  just plug in and publish. save all the wiring and System integration.","","👍 (1)"
"817835202746253344","IIoT#4707","2023-09-28T19:13:25.3860000+08:00","GG @Mark O'Donovan, you just advanced to level 12!","",""
"1129435706285101076","ted.garrison","2023-09-28T20:06:37.9500000+08:00","Haven't come across any.   You'll probably be stuck pulling in a 4-20mA from something like a Banner ToF.  Looks like they have some that may have the resoltion to detect the difference in each sheet. (of course, that assumes that the stack weight doesn't compress the stack)","",""
"1073312001788477471","sparkylarks","2023-09-28T20:07:49.9410000+08:00","It will ,but **""Don't let perfect be the enemy of good""**","",""
"1129435706285101076","ted.garrison","2023-09-28T20:09:24.5190000+08:00","yeah.. you can probably figure it out long term, but for starters simple division will get you darn close.","",""
"740383178279354388","mriiot","2023-09-30T08:28:34.7720000+08:00","Bruh, check out the Sharc.   https://mriiot.com/sharc","","👍 (4)"
"898217314741280828","hobbes1069","2023-10-03T01:52:09.7200000+08:00","You could try something like this. This is where IO Link really shines. Not only does it give you the reading directly, it can tell you if something is wrong, which a 4-20ma sensor can't really do. This one reads up to 600mm but I'm sure there are other models:
https://www.pepperl-fuchs.com/usa/en/classid_53.htm?view=productdetails&prodid=88710","",""
"873009180938743828","sim_sam3","2023-10-06T21:38:27.2570000+08:00","Just came across this gadget, anyone heard of? Anyone use? https://flipperzero.one/","",""
"794542235676180500","akoscs","2023-10-09T04:38:11.5550000+08:00","I am contemplating buying one fro at least a year now. It is really cool, but I am afraid I would not use it much. I only have so many RFID card to copy and just the one WiFi network to hack legally (assuming you are buying the wifi extension). Opening old car doors is not my thing. If you are into electronics and planniung to solder your own extentions, or have problems debugging one-wire and similar things, than it is a very helpful tool.","","👍 (1)"
"742752935947010118","busch1974","2023-10-10T02:37:53.8010000+08:00","Has anyone had experience with IO-LINK wireless https://youtu.be/4FLWDUm_Les","","👍 (2)"
"742752935947010118","busch1974","2023-10-11T21:05:42.1730000+08:00","We are moving forward with targeted sensor implementation for conditional monitoring.  We are a MS / SAP / Ignition shop.  We are looking to standardize on IO-Link protocol for sensor selection (IFM, BAlluff ect.)  We expect to primarily use wired connected sensors  but also need to consider wireless alternatives..   Does anyone have good experience with wireless  protocols and solutions  i.e.,  IO Link wireless, , LoRaWAN, ISA 100.   Wireless IO Link would be preferred if our wired topology is IO Link.  What is the groups experience with wireless sensor in the plants.","",""
"740383178279354388","mriiot","2023-10-11T21:07:03.2940000+08:00","Its nice.  We use it to flash ESP32s in the field.","","👍 (1)"
"798219851352899625","8elahr","2023-10-17T00:06:27.7280000+08:00","I can hook you up via email with the PM at Balluff for IO-Link wireless. 
Send me a DM and I’ll pass that on. 
I peronally know a few use cases for io-link wireless. For example a turn table loading parts, or any rotation parts or grippers, … 
For wired sensors, what do you want to use? We have a SAMS product group, that has outstanding additional data points, that you can use. 
For example we have sensors that measure the device orientation. You could use that data point to react to misalignments due to damage … 
And in case you look for a data integration platform, you could also take a look at our ADP. 
www.balluff.com/go/adp. 
In case you need any more info’s drop me a message or ping me here","",""
"846166843101413437","hashbrown1024","2023-10-17T10:34:47.0740000+08:00","@RickBullotta - can you please connect me with the guy who's building AI layer on it?","","👍🏼 (1)"
"867075936054149191","rickbullotta","2023-10-17T12:09:37.1070000+08:00","Message me your email and I’ll connect you","",""
"745796393855352953","thedavidschultz","2023-10-19T04:51:15.7720000+08:00","I am working on an application for a remote temperature sensor to measure hot plastic coming out of an extruder. The client has a quote from Keyence for an IR sensor. I am coonsidering an ifm sensor and using IO-Link or a 4-20mA sensor with a groov RIO. Any recommendations?","",""
"740383178279354388","mriiot","2023-10-19T09:06:18.6800000+08:00","Ill get u a deal on a Sharc.","","👍🏻 (1)"
"894527802316046366","nickn5549","2023-10-19T14:57:04.6830000+08:00","might need a couple too - for analogic vacuum sensors. Had enough to build the gateways by hand for analogic sensors....time to buy some 🦈","","👍 (1)"
"740383178279354388","mriiot","2023-10-19T21:12:42.2120000+08:00","Here are the “docs”.  Its pretty stupid simple though as long as your PoE spins the same direction as it does in the US.  https://github.com/SharcTech/sharc-support","","💕 (1)"
"475955754788978688","jdingus","2023-10-20T00:17:40.4640000+08:00","@DavidSchultz  We are in the final stages POC with this product offering.  Real easy to work with MQTT compatible, reasonably priced.
Is a turntable application where wireless is necessary and measuring mold temperatures.
http://store.ncd.io","",""
"745796393855352953","thedavidschultz","2023-10-20T01:54:40.9730000+08:00","Looks like a pretty solid platform. I did not notice a remote temperature measuring device, like an IR sensor.","",""
"856636096225607691","niemilkm","2023-10-20T02:05:58.6440000+08:00","I've used NCD hardware multiple times - great hardware (sensors and gateway) and team (Travis and Anil).","",""
"898217314741280828","hobbes1069","2023-10-20T03:55:30.7720000+08:00","I still love Rio's for some things but really becomming a fan of IO Link sensors. Sensor data, diagnostics, and configuration over 3 wires. Hard to beat. I'm running running a pilot using a Balluff CMTK to monitor 3 nitric acid tanks with Keyence level sensors. Nice to be able to do all the configuration through the CMTK.

Let me know if you have time and I'll give you a virtual tour.","",""
"475955754788978688","jdingus","2023-10-20T07:07:57.9100000+08:00","You can plug a standard sensor in and monitor that way.  For $250 it’s a great value.  Key thing is if wireless (no remote power) is needed and also how often you need to take readings.  
Wouldn’t use one of these for high frequency applications .  Curious to try out more of their products though.

https://store.ncd.io/product/industrial-iot-long-range-wireless-4-20ma-current-receiver/","",""
"696690111911428159","dartg.","2023-11-29T16:17:42.1630000+08:00","I noticed a few articles and videos on IO-Link safety in general since the sps fair in Germany. I have been unable to see any part numbers for safety masters. Can anyone confirm if any vendor has launched io-link safety master?","",""
"1129435706285101076","ted.garrison","2023-11-29T22:12:41.3200000+08:00","Interested to know more about how that's going as well.  We've been running RIOs so far, but since we're also starting to roll out some Banner DXM units, I was starting to poke around their IO-Link stuff some yesterday.  Looks like it could be a nicer solution from a simplicity standpoint.","",""
"898217314741280828","hobbes1069","2023-11-29T22:17:42.4780000+08:00","Loving the solution so far. The only problem I'm having is that the sensors we're using aren't ideal for the application. We using them because we haven't found a solution that is 🙂 Keyence is considering bringing a new sensor into the US that would be perfect, but not available outside of Japan yet.","",""
"1129435706285101076","ted.garrison","2023-11-29T22:17:57.1400000+08:00","Pretty sure I've got a few hundred of these (the version that has 2 Temp/Vib sensors mounted) around my facilities via a 3rd party monitoring system (rebranded of course).  They've been rocksolid so far.","",""
"475955754788978688","jdingus","2023-11-29T22:22:12.9170000+08:00","Good to know, we are likely going to move forward with some more of these.  You guys using MQTT as well?","",""
"1129435706285101076","ted.garrison","2023-11-30T05:44:44.4690000+08:00","I'm not positive they're NCD unites, but they sure do look identical.  Yes. They publish up to a bunch of local RPi gateways which then publishes out to the 3rd parties Azure setup via MQTT.  Eventually I'll probably swap it all out with basically the same thing, but self-owned... but for now, they filled an immediate need in a matter of weeks.  I currently don't have to touch any of it - it's all handled and owned by the 3rd party.","",""
"769845221470109706","alenduranovic","2023-12-22T20:27:28.6490000+08:00","Hello people. What vendors would you recommend that offer hardware for measuring water, gas and electricity consumption without need to use their analytics platform and with possibility to extract data through network?","",""
"769397045579481129","donpancoe","2023-12-22T20:47:03.3410000+08:00","I had the same issue and found EKM Metering. Their website certainly promotes their cloud-based monitor offering, but I find that most of their meter hardware offers simple pulse outputs that can be read with a PLC totalizer for running consumption totals. https://www.ekmmetering.com/","",""
"740383178279354388","mriiot","2023-12-22T22:33:20.1160000+08:00","What are the inputs for measuring utilities?  How do you hook up to a gas meter for example?","",""
"769397045579481129","donpancoe","2023-12-22T22:56:35.9120000+08:00","I've only worked with the power meters, which use current transformer loops and cable-piercing voltage taps, but it looks like the water and gas meters are placed in-line, just like utility meters.","",""
"740383178279354388","mriiot","2023-12-22T23:53:22.3180000+08:00","I would say try our SHARC hardware.  As long as we can get a pulse or 4-20 then we can measure","",""
"135225812080263169","theober","2023-12-23T01:08:23.2220000+08:00","Depends on how industrial you're looking for - using a low-code platform like Node-RED opens up a lot of low-cost / flexible possibilities... 

Phidgets are great low-cost devices and they've written their own nodes, 
I've used Kasa smart home plugs before for power monitoring, 
Digikey/Mouser has a ton of current clamps, easy to connect to  rasPi's etc

the benefit to node-red being you have complete control around about your export/networking method, but drawbacks being it's truly just a platform and you'll need to learn a bit about how everything connects","",""
"898217314741280828","hobbes1069","2023-12-23T04:17:54.5980000+08:00","For power I've been looking at the Opto 22 groov Rio EMU:
https://info.opto22.com/groov-rio-energy-monitoring-unit","","opto22 (1)"
"1088380622734631002","see_north.","2024-01-19T04:28:33.8280000+08:00","We're looking to establish some cleanrooms in our facilities. I'd like to start monitoring air particle count to see where we sit with our existing facilities. The intent would be that if/when we implement cleanrooms, we can add additional sensors (inside the cleanrooms) to understand just how much cleaner those environments are (and if we are meeting the standard that we're aiming for). 
Does anyone have a good recommendations for sensors? I'm pretty new to the whole IIoT thing but ideally we're after something that aligns nicely with the UNS approach.","",""
"1073312001788477471","sparkylarks","2024-01-19T04:34:24.2800000+08:00","Are you connected in to  a pulse from the meter?
I have one of theses on my desk. A great piece of kit, 10 minutes I I was logging counts to a MQTT broker https://www.hw-group.com/device/poseidon2-3268","",""
"1129435706285101076","ted.garrison","2024-01-19T06:01:54.2180000+08:00","Keyence makes some nice clamp-on meters for fluid flow measurement.  We have some measuring hydraulic fluid flow.  Fed back to a Opto22 Rio to get it converted to MQTT.   Amazingly accurate.","",""
"1129435706285101076","ted.garrison","2024-01-19T06:03:14.7040000+08:00","also https://ncd.io/ has some power monitoring stuff (and lots of other stuff), some of which can do straight to MQTT.","",""
"435342889875275776","george9330","2024-02-15T23:14:21.8560000+08:00","https://www.controllino.com/io-bean/","","🔥 (1)"
"1030204941383503872","loganmoline","2024-02-19T12:52:05.7330000+08:00","Have been trying to find a straight answer as to whether I/o link sensors of one manufacture (in my case Balluff) can be configured on the master ( and with the software) of another manufacturer(in my case IFM). They all go on and on about how they are all part of the Open Industry 4.0 alliance, but I only see ifm sensors and masters in the moneo software. 
Would any of you have any insights into this?","",""
"766684226455207996","bright_hummingbird_31342","2024-02-19T16:06:47.3610000+08:00","You can mix and match sensors and masters, but the experience is far superior if you try to keep things within one brand.  The cross-vendor interoperability of IO-Link is defined by the IO Device Description (IODD).  You can use this with any IO-Link device.  Many people actually store the config on a PLC to ""write"" to the device.  This is very useful for replacing a failed sensor without needing to program it.

There are some offerings that go beyond the IO-Link spec.  For example, if you download IFM's ""Start Up Package"" for its masters supporting PROFINET, there are function blocks that can be imported into Siemens TIA Portal to specifically interface with IFM products.  It's like having a driver for the device.  This is in contrast of mapping in and out of a generic IODD structure exchanged over PROFINET.  Additionally, IFM's LR-Device or Moneo software will have libraries, configuration menus, photos, etc of their own sensors.  It's these libraries and applications are what make IO-Link useful as a tech IMO.

It would be nice to see more elegant cross-vendor integrations, but the spec only goes so far and it takes work to maintain those libraries.  At the end of the day, IO-Link is mostly field protocol that connects to devices over a standard M12 cable.  The compute on these devices is often more primitive than what is needed to support TCP/IP Ethernet.  There isn't much room for overhead in the protocol.  It has a simple object model.  The clients need to do most of the work to really make use of it.","",""
"898217314741280828","hobbes1069","2024-02-19T23:37:01.1900000+08:00","To reinforce what @js said, I've mostly had good luck mixing masters and sensors. The Balluff CMTK is an amazing device. I have one deployed and really need to buy another for the lab. I recently bought a Balluff condition monitoring sensor (x/y/z vibration, temp, humidity, contact temp) and hooked it up to the only IO Link master I have handy right now, a P+F (i.e. Comtrol) master. I can read everything out of the sensor fine on the built in web server but it's only outputting raw data from the sensor via MQTT and there doesn't seem to be a way to fix that on the P+F master.","",""
"898217314741280828","hobbes1069","2024-02-19T23:38:08.7320000+08:00","For my deployed CMTK, I've got it connected to 3 Keyence level sensors and a Patlite Andon light and it's all worked flawlessly.","",""
"1030204941383503872","loganmoline","2024-02-20T00:08:02.1710000+08:00","Thanks guys. This helps a lot.","",""
"1128195418522652793","alpha.point","2024-03-20T08:28:26.6500000+08:00","Which wireless protocol did you pick for your sensor implementation in the plants?","",""
"798219851352899625","8elahr","2024-03-27T03:09:02.3610000+08:00","I work for Balluff, if you need more info send me a DM","",""
"795725198980677734","diederik9434","2024-03-28T18:42:38.9770000+08:00","Hi guys, if you have sensor data in the UNS, what context do you typically add to make the data more valuable?","",""
"898217314741280828","hobbes1069","2024-03-28T19:30:40.0310000+08:00","At minimum `value`, `timestamp`, and `UoM`. Any extra metadata should be based on your needs. You may want to add a `location: SW Electrical Closet`.","",""
"1129435706285101076","ted.garrison","2024-03-28T19:42:58.5290000+08:00","Context about the sensor? or about what's happening while the sensor is doing it's thing?  For #2, what is the job being run? who's the operator? what are the values of settings that could affect the sensor's value..","",""
"795725198980677734","diederik9434","2024-03-28T19:43:22.9100000+08:00","top of my mind i'm having this:","https://cdn.discordapp.com/attachments/841346396639723553/1222873670171754606/image.png?ex=68df0e1a&is=68ddbc9a&hm=49d432316e2747440556ab1b649108391b035e2c397652e3bf311997466bbc0c&",""
"795725198980677734","diederik9434","2024-03-28T19:44:01.1000000+08:00","What is UoM? 🙂","",""
"795725198980677734","diederik9434","2024-03-28T19:44:18.7400000+08:00","Unit of measurement? :p ok should have known that one","",""
"1073312001788477471","sparkylarks","2024-03-28T19:48:49.9790000+08:00","Ideally I would include the raw measurement, 
and if there is onboard configuration settings it is good to take those, but you can put them into another topic 

I cannot count how many time the scaling of a temperature Transmitter was wrong when installed, but at 21°C the figure on screen looks right,","",""
"795725198980677734","diederik9434","2024-03-28T19:56:21.7250000+08:00","Wait, could you explain a bit further? i dont really get it 🙂","",""
"1129435706285101076","ted.garrison","2024-03-28T20:01:53.8400000+08:00","Mark's comment?   Basically, if you store the raw value coming off the sensor (not the scaled value) you can always go back and re-scale it when you determine later that the scaling was wrong.  So when you find out that you had the thermocouple scaling as a Type K instead of a Type D, you can fix your historical data.     The problem with scaling is, a lot of times, the ""desk"" temp is close enough you don't realize your scaling wrong.  It's only at the higher (or lower) temps when you find it out...","","💯 (1)"
"795725198980677734","diederik9434","2024-03-28T20:05:53.9490000+08:00","ok makes sense, you are mostly doing this to compensate for human error? If it is installed/configured wrong, i can rescale to still have a correct value?","",""
"795725198980677734","diederik9434","2024-03-28T20:06:06.4500000+08:00","ok, yea that has some added value","",""
"1129435706285101076","ted.garrison","2024-03-28T20:07:11.9910000+08:00","yup.. either it got configured wrong, or someone replaced it with something similar, but with a different range, so it needs a different scaling..","","😅 (2)"
"1129435706285101076","ted.garrison","2024-03-28T20:07:27.4990000+08:00","if you've got the raw reading, you can always go back and fix the scaling.","",""
"795725198980677734","diederik9434","2024-03-28T20:14:12.1850000+08:00","ahhhh yea, ""it's kind of the same sensor, it will probably work"" OK i can totally see this is real life now","","👍 (1)"
"1129435706285101076","ted.garrison","2024-03-28T20:16:19.0940000+08:00","happens all the time.","",""
"1073312001788477471","sparkylarks","2024-03-28T20:56:07.0410000+08:00","I had one Job where the TT's were one of two ranges 0-50 and and -50 to 150, so on a warm summer day( in Ireland)  25 Deg was 10mA  so even with the right scale we had the wrong temperature,

It was only when we started heating water we started to find something was wrong. IIRC the specification called for 0 to 50 in some places but they got replaced with -50 to 150 and the information didn't flow through

So I ended up walking around the site, with a flask of hot water, and a mechanical fitter so I could get two data points, to verify.","","👍 (1)"
"1050051809789624320","eoinmurphy","2024-03-28T21:36:31.6330000+08:00","To add to what was already suggested...some additional context for sensors (if this data is available) would be to include make, model, installed date, last calibrated date, next calibration due date.","",""
"795725198980677734","diederik9434","2024-03-28T21:51:54.0530000+08:00","Calibration info is relevant! Good suggestion, Thanks!","",""
"1073312001788477471","sparkylarks","2024-03-28T21:55:32.8090000+08:00","If the instrument knows it's last calibration date great, but it might need to come from your CMMS or other system and be published into the instrument namespace. 

but especially useful for things where the number of operations becomes important, not just the time between calibrations.","",""
"795725198980677734","diederik9434","2024-03-28T22:24:47.8980000+08:00","Yes, X amount of measurements allowed before recallibration is needed for example. I have kind of that usecase","",""
"898217314741280828","hobbes1069","2024-03-28T23:39:10.4240000+08:00","But now I think you're getting into multiple topics, I wouldn't want to publish one monolithic complex JSON payload for every sensor reading.","","💯 (3)"
"1214242167640424619","zack.scriven","2024-03-29T10:18:40.4680000+08:00","Thank you @Richard Shaw @Mark O'Donovan @Ted Garrison and @Eoin Murphy for answering this","",""
"1214242167640424619","zack.scriven","2024-03-29T10:18:54.0570000+08:00","Great question","",""
"1223327297659207821","shogg0828","2024-04-05T19:53:30.7490000+08:00","Anyone have any experience getting Power Radar data (Centrica) out of their system to something that is useful?","",""
"1214242167640424619","zack.scriven","2024-04-06T12:11:05.5960000+08:00","🤔","",""
"709457967140831232","pat.stave","2024-04-08T15:17:03.0390000+08:00","Does anyone have experience with battery powered sensors utilizing Narrowband-IoT as communication interface?","",""
"475955754788978688","jdingus","2024-04-08T21:44:24.0870000+08:00","NCD.io may be worth checking out.","",""
"1057737574287945899","xamp4248","2024-04-08T23:25:38.5730000+08:00","I did some projects with LoWAN","",""
"709457967140831232","pat.stave","2024-04-09T16:11:30.4450000+08:00","I am specifically looking for NB-IoT devices. In Norway we have excellent existing infrastructure, so no backbone gateways would be needed. I couldnt find any NB-IoT-devices on NCD.io","","👍 (1)"
"740383178279354388","mriiot","2024-04-10T09:27:29.6200000+08:00","What kind of sensors specifically","",""
"709457967140831232","pat.stave","2024-04-10T15:57:45.6440000+08:00","I would like a vendor that has a variety of process sensors and climate sensors. Also a general purpose analog + digital IO module where you can connect your own sensor element","",""
"740383178279354388","mriiot","2024-04-10T20:12:08.0320000+08:00","What about Walter is necessary and what is not?  https://www.crowdsupply.com/dptechnics/walter","","👍🏻 (1)"
"817835202746253344","IIoT#4707","2024-04-10T20:12:08.3360000+08:00","GG @MRIIOT, you just advanced to level 14!","",""
"894527802316046366","nickn5549","2024-04-10T20:29:16.6360000+08:00","I should build some...","",""
"709457967140831232","pat.stave","2024-04-10T22:08:51.1670000+08:00","Ohh that is really nice! Thank you!","",""
"944630646821773392","m_r_mccormick","2024-04-11T05:58:50.9620000+08:00","I am looking for an energy monitoring device for 120V max 10A (20 A is a bonus) with NEMA  5-15P input and output, and MQTT or spB or OPC or EASILY interface with an arduino/rpi. Amperage monitoring required, voltage monitoring highly desired, and power factor et al preferred. Does anyone have any recommendations or suggestions that might fit the bill?","",""
"693309801589112862","_dyland","2024-04-11T06:03:32.8810000+08:00","Do any of the Shelly Power Metering devices meet the requirements?
https://www.shelly.com/en-us/products/shop/shelly-pro-3-em","",""
"944630646821773392","m_r_mccormick","2024-04-11T06:19:48.5260000+08:00","I'm hoping for something more 'consumer' looking that will more easily get through a university IT approval process, and hopefully not require an enclosure and a bunch of wiring. From a technical perspective, I believe it likely would with converting webhooks as needed.","","👍 (1)"
"475955754788978688","jdingus","2024-04-11T07:00:05.3320000+08:00","www.pressac.com has a really nice product that is wireless and actually uses the inductive power from the leads to power it.  Not used personally yet but know it’s been vetted and used by a global manufacturer.","","👍 (1)"
